NOMBREPROYEC,URL,CARRERA,FACULTAD
Análisis de cumplimiento tributario correspondiente al período fiscal 2008 de una empresa dedicada a la compra y venta de electrodomésticos localizada en varios cantones de la provincia del Guayas y Los Ríos,https://dspace.espol.edu.ec/handle/123456789/36787,Ingeniería en Auditoría y Contaduría Pública Autorizada,Facultad de Ciencias Naturales y Matemáticas
AuditorÌa del Rubro Cuentas por Cobrar- Ingresos de una empresa dedicada a la comercializaciÛn de tableros aglomerados por el período terminado el 31-12-2007 en la Ciudad de Guayaquil,https://dspace.espol.edu.ec/handle/123456789/65704,Ingeniería en Auditoría y Contaduría Pública Autorizada,Facultad de Ciencias Naturales y Matemáticas
Levantamiento y diseño de procesos de investigación alineado al criterio del caces para la facultad de ciencias sociales,https://dspace.espol.edu.ec/handle/123456789/48841,Ingeniería en Auditoría y Contaduría Pública Autorizada,Facultad de Ciencias Naturales y Matemáticas
"Auditoría del Rubro Ventas, Cuentas por Cobrar y Efectivo Para una Empresa Industrial del Sector Alimenticio al 30 de septiembre del 2008 Ubicada en la Ciudad de Guayaquil.",https://dspace.espol.edu.ec/handle/123456789/12219,Ingeniería en Auditoría y Contaduría Pública Autorizada,Facultad de Ciencias Naturales y Matemáticas
Diseño de sistema de control aplicado a un centro de desarrollo infantil mediante la aplicación de la metodología de mejora 5S,https://dspace.espol.edu.ec/handle/123456789/38718,Ingeniería en Auditoría y Contaduría Pública Autorizada,Facultad de Ciencias Naturales y Matemáticas
Diseño de un plan de auditoría financiera al rubro cuentas por cobrar de una empresa dedicada a la presentación de servicios de asistencia de remolque portuario para atraque y desatraque de buques. Período 2013,https://dspace.espol.edu.ec/handle/123456789/37162,Ingeniería en Auditoría y Contaduría Pública Autorizada,Facultad de Ciencias Naturales y Matemáticas
Diseño de un sistema de gestión del microciclo de abastecimiento para una empacadora de camarón en la ciudad de arenillas,https://dspace.espol.edu.ec/handle/123456789/51763,Ingeniería en Auditoría y Contaduría Pública Autorizada,Facultad de Ciencias Naturales y Matemáticas
Diseño de un Sistema de Control aplicado al Área de Producción de Embutidos en una Empresa Avícola para la mejora administrativa y financiera a través del levantamiento de indicadores de medición,https://dspace.espol.edu.ec/handle/123456789/40713,Ingeniería en Auditoría y Contaduría Pública Autorizada,Facultad de Ciencias Naturales y Matemáticas
Actualización de un sistema de gestión de calidad según la norma iso 9001:2015 dirigido a una empresa dedicada a ofrecer capacitaciones.,https://dspace.espol.edu.ec/handle/123456789/44694,Ingeniería en Auditoría y Contaduría Pública Autorizada,Facultad de Ciencias Naturales y Matemáticas
"Diseño de un sistema de gestión por procesos para una empresa que brinda soluciones integrales de seguridad en transporte de productos, ubicada en la ciudad de guayaquil",https://dspace.espol.edu.ec/handle/123456789/52944,Ingeniería en Auditoría y Contaduría Pública Autorizada,Facultad de Ciencias Naturales y Matemáticas
Análisis tributario y financiero sectorial  estudio de caso: empresas productoras y comercializadoras de  elaborados de cacao (chocolate),https://dspace.espol.edu.ec/handle/123456789/41191,Ingeniería en Auditoría y Contaduría Pública Autorizada,Facultad de Ciencias Naturales y Matemáticas
"Análisis tributario y financiero sectorial, estudio del caso:  contribuyentes especiales del sector hotelero",https://dspace.espol.edu.ec/handle/123456789/52430,Ingeniería en Auditoría y Contaduría Pública Autorizada,Facultad de Ciencias Naturales y Matemáticas
Desarrollo del Procedimiento de gestión para el proceso de adquisición y administración de proveedores en una empresa importadora de vehículos de la ciudad de Guayaquil,https://dspace.espol.edu.ec/handle/123456789/39378,Ingeniería en Auditoría y Contaduría Pública Autorizada,Facultad de Ciencias Naturales y Matemáticas
Análisis tributario y financiero sectorial estudio de caso: productores de articulos absorbentes de higiene personal y papel higienico,https://dspace.espol.edu.ec/handle/123456789/39485,Ingeniería en Auditoría y Contaduría Pública Autorizada,Facultad de Ciencias Naturales y Matemáticas
Análisis y mejora de la experiencia de los clientes respecto a compras online de productos de primera necesidad de una empresa del sector de retail ubicada en la ciudad de guayaquil.,https://dspace.espol.edu.ec/handle/123456789/51904,Ingeniería en Auditoría y Contaduría Pública Autorizada,Facultad de Ciencias Naturales y Matemáticas
"Auditoría del rubro compras costo de venta, cuentas por pagar de los estados financieros de una compañía dedicada a la compra y venta al por mayor y menos de maquinaria industrial usada",https://dspace.espol.edu.ec/handle/123456789/36425,Ingeniería en Auditoría y Contaduría Pública Autorizada,Facultad de Ciencias Naturales y Matemáticas
Diseño de un sistema de gestión por procesos aplicado a un centro médico ubicado en la ciudad de Guayaquil,https://dspace.espol.edu.ec/handle/123456789/37874,Ingeniería en Auditoría y Contaduría Pública Autorizada,Facultad de Ciencias Naturales y Matemáticas
Análisis tributario y financiero sectorial: estudio caso exportadoras de camarón,https://dspace.espol.edu.ec/handle/123456789/44695,Ingeniería en Auditoría y Contaduría Pública Autorizada,Facultad de Ciencias Naturales y Matemáticas
Diseño de un sistema de gestión en el área de producción de una empresa florícola,https://dspace.espol.edu.ec/handle/123456789/39691,Ingeniería en Auditoría y Contaduría Pública Autorizada,Facultad de Ciencias Naturales y Matemáticas
"Diseño de un sistema de control aplicado al área de comercialización de una fabrica de productos alimenticios elaborados a base de coco, para la mejora administrativa y financiera de la organización, a través de indicadores de gestión",https://dspace.espol.edu.ec/handle/123456789/38612,Ingeniería en Auditoría y Contaduría Pública Autorizada,Facultad de Ciencias Naturales y Matemáticas
Diseño del cuadro de mando integral con la metodología del Balanced Scorecard a una distribuidora de materiales de construcción en la ciudad de Durán,https://dspace.espol.edu.ec/handle/123456789/38674,Ingeniería en Auditoría y Contaduría Pública Autorizada,Facultad de Ciencias Naturales y Matemáticas
Auditoría del rubro cuentas por cobrar e ingresos de la empresa que se dedica a la promoción y desarrollo de institutos y establecimientos preeducativos y educativos por el periodo terminado al 31 de diciembre de 2007 en la ciudad de Guayaquil,https://dspace.espol.edu.ec/handle/123456789/39095,Ingeniería en Auditoría y Contaduría Pública Autorizada,Facultad de Ciencias Naturales y Matemáticas
Elaboración de un sistema de control de gestión basado en la metodología del balanced  scorecard en una fábrica de plásticos en la ciudad de guayaquil,https://dspace.espol.edu.ec/handle/123456789/39932,Ingeniería en Auditoría y Contaduría Pública Autorizada,Facultad de Ciencias Naturales y Matemáticas
"Auditoría al proceso de producción y desarrollo de un plan de mejoras aplicado a una empresa de fabricación de protectores para banano, ubicada en la ciudad Babahoyo",https://dspace.espol.edu.ec/handle/123456789/39669,Ingeniería en Auditoría y Contaduría Pública Autorizada,Facultad de Ciencias Naturales y Matemáticas
Diseño de un sistema de control de gestión aplicando reingeniería de procesos y Lean Construction al área de proyectos en una empresa que se dedica a la construcción de obras civiles,https://dspace.espol.edu.ec/handle/123456789/38825,Ingeniería en Auditoría y Contaduría Pública Autorizada,Facultad de Ciencias Naturales y Matemáticas
Análisis contables y tributario de la aplicación de la niif 15 “ingresos ordinarios procedentes de contratos con clientes” a una empresa exportadora de frutas..,https://dspace.espol.edu.ec/handle/123456789/52902,Ingeniería en Auditoría y Contaduría Pública Autorizada,Facultad de Ciencias Naturales y Matemáticas
Diseño de un sistema de gestión por procesos en una empresa dedicada a la venta al por menor de combustible para automotores y motocicletas ubicada en la ciudad de Guayaquil,https://dspace.espol.edu.ec/handle/123456789/38687,Ingeniería en Auditoría y Contaduría Pública Autorizada,Facultad de Ciencias Naturales y Matemáticas
"Diseño de un sistema de gestión por procesos aplicado a una empresa de fabricación de maquinarias industriales, ubicada en la ciudad de guayaquil.",https://dspace.espol.edu.ec/handle/123456789/39379,Ingeniería en Auditoría y Contaduría Pública Autorizada,Facultad de Ciencias Naturales y Matemáticas
Diseño de una planificación estratégica para una empresa dedicada a la compra y venta de repuestos automotrices en la ciudad de Guayaquil,https://dspace.espol.edu.ec/handle/123456789/38851,Ingeniería en Auditoría y Contaduría Pública Autorizada,Facultad de Ciencias Naturales y Matemáticas
"Diseño de un sistema de gestión por procesos para una fundación dedicada a brindar diversos tipos de asistencia social a comunidades vulnerables, ubicada en la ciudad de Guayaquil",https://dspace.espol.edu.ec/handle/123456789/52955,Ingeniería en Auditoría y Contaduría Pública Autorizada,Facultad de Ciencias Naturales y Matemáticas
Informe del cumplimiento tributario correspondiente al período fiscal 2007 de una empresa importadora y comercializadora de productos para la iluminación,https://dspace.espol.edu.ec/handle/123456789/37170,Ingeniería en Auditoría y Contaduría Pública Autorizada,Facultad de Ciencias Naturales y Matemáticas
Diseño de un sistema de gestión de calidad para la línea de negocio inmobiliario utilizando los estándares establecido por las Normas ISO 9001: 2008,https://dspace.espol.edu.ec/handle/123456789/38788,Ingeniería en Auditoría y Contaduría Pública Autorizada,Facultad de Ciencias Naturales y Matemáticas
Diseño de un sistema de calidad basado en la norma internacional ISO 9001:2008 en una empresa comercializadora de insumos médicos ubicada en la ciudad de Guayaquil,https://dspace.espol.edu.ec/handle/123456789/38090,Ingeniería en Auditoría y Contaduría Pública Autorizada,Facultad de Ciencias Naturales y Matemáticas
"Análisis y propuestas de mejora de procesos de gestión universitaria en una entidad de educación superior, a través de indicadores aplicados a una facultad de la misma",https://dspace.espol.edu.ec/handle/123456789/38969,Ingeniería en Auditoría y Contaduría Pública Autorizada,Facultad de Ciencias Naturales y Matemáticas
"Diseño de un sistema de control de inventario basado en el método ABC, aplicado a una empresa de producción agrícola",https://dspace.espol.edu.ec/handle/123456789/38083,Ingeniería en Auditoría y Contaduría Pública Autorizada,Facultad de Ciencias Naturales y Matemáticas
"Diseño de un sistema de gestión por procesos enfocado al criterio de acreditación del CEAACES denominado estudiantes para una facultad de una institución de educación superior, ubicada en la Ciudad de Guayaquil",https://dspace.espol.edu.ec/handle/123456789/51746,Ingeniería en Auditoría y Contaduría Pública Autorizada,Facultad de Ciencias Naturales y Matemáticas
"Análisis cuantitativo de Gestión a los Procesos Administrativos y Financieros de la compañía de transporte pesado del Ecuador YAPELSA S.A., mediante indicadores de medición",https://dspace.espol.edu.ec/handle/123456789/39272,Ingeniería en Auditoría y Contaduría Pública Autorizada,Facultad de Ciencias Naturales y Matemáticas
Desarrollo de un plan de implementación de las NIIF para una compañía dedicada a la importación y distribución de repuestos automotores para vehículos livianos en la ciudad de Guayaquil para el año 2009,https://dspace.espol.edu.ec/handle/123456789/36426,Ingeniería en Auditoría y Contaduría Pública Autorizada,Facultad de Ciencias Naturales y Matemáticas
"Diseño de un sistema de gestión por procesos para una empresa dedicada a la distribución y comercialización al por mayor de electrodomésticos a nivel nacional, ubicada en la ciudad de guayaquil.",https://dspace.espol.edu.ec/handle/123456789/52951,Ingeniería en Auditoría y Contaduría Pública Autorizada,Facultad de Ciencias Naturales y Matemáticas
Análisis de la Rentabilidad de una Distribuidora de Telefonía Móvil Sucursal Policentro Período 2006,https://dspace.espol.edu.ec/handle/123456789/38324,Ingeniería en Auditoría y Contaduría Pública Autorizada,Facultad de Ciencias Naturales y Matemáticas
Diseño de un sistema de control operacional para una empresa agroquímica alineado a SART,https://dspace.espol.edu.ec/handle/123456789/38775,Ingeniería en Auditoría y Contaduría Pública Autorizada,Facultad de Ciencias Naturales y Matemáticas
Auditoría del rubro cartera de vivienda de una institución financiera ubicada en la ciudad de Guayaquil por el período terminado el 31 de diciembre del 2008,https://dspace.espol.edu.ec/handle/123456789/37146,Ingeniería en Auditoría y Contaduría Pública Autorizada,Facultad de Ciencias Naturales y Matemáticas
Diseño de un Sistema de Gestión Aplicado al Área Operativa de una Cooperativa de Transporte,https://dspace.espol.edu.ec/handle/123456789/38198,Ingeniería en Auditoría y Contaduría Pública Autorizada,Facultad de Ciencias Naturales y Matemáticas
"Diseño de un Sistema de Gestión por Procesos enfocado al criterio de acreditación del CEAACES denominado Academia, para una Facultad de una Institución de Educación Superior ubicada en la Ciudad de Guayaquil",https://dspace.espol.edu.ec/handle/123456789/54444,Ingeniería en Auditoría y Contaduría Pública Autorizada,Facultad de Ciencias Naturales y Matemáticas
"Diseño de un sistema de gestión por procesos para una empresa dedicada a la venta de artículos de ferretería, seguridad industrial, herramientas y maquinarias ubicada en la ciudad de Guayaquil",https://dspace.espol.edu.ec/handle/123456789/38958,Ingeniería en Auditoría y Contaduría Pública Autorizada,Facultad de Ciencias Naturales y Matemáticas
"Propuesta de mejora de procesos Académicos, Administrativos y Financieros de una Facultad en una Institución de Educación Superior",https://dspace.espol.edu.ec/handle/123456789/39301,Ingeniería en Auditoría y Contaduría Pública Autorizada,Facultad de Ciencias Naturales y Matemáticas
Diseño de un Sistema de Gestión por Procesos para una empresa dedicada a coordinar las Actividades de Sanidad de las Fuerzas Armadas de la Zona Occidental-Insular del Ecuador ubicada en la ciudad de Guayaquil,https://dspace.espol.edu.ec/handle/123456789/41256,Ingeniería en Auditoría y Contaduría Pública Autorizada,Facultad de Ciencias Naturales y Matemáticas
"Análisis del cumplimiento tributario de la cuenta Gastos de una empresa que se dedica a la construcción ubicada en la ciudad de Guayaquil, periodo fiscal 2008",https://dspace.espol.edu.ec/handle/123456789/37171,Ingeniería en Auditoría y Contaduría Pública Autorizada,Facultad de Ciencias Naturales y Matemáticas
Realización de un sistema de gestión de la calidad para mejorar el rendimiento en la prestación del servicio y producción de alimentos en una empresa de la industria de hotelería y turismo de la provincia de Santa Elena.,https://dspace.espol.edu.ec/handle/123456789/52188,Ingeniería en Auditoría y Contaduría Pública Autorizada,Facultad de Ciencias Naturales y Matemáticas
"Optimización y control de los gastos de viaje por medio de implementación de directrices y metas presupuestarias de una compañía dedicada al servicio de  metrología, ubicada en la ciudad de guayaquil.",https://dspace.espol.edu.ec/handle/123456789/51886,Ingeniería en Auditoría y Contaduría Pública Autorizada,Facultad de Ciencias Naturales y Matemáticas
"Impacto contable, tributario y financiero obtenido del análisis comparativo respecto a la determinación y liquidación del impuesto único de empresas relacionadas, dedicadas a la exportación de banano no producido por el mismo sujeto pasivo.",https://dspace.espol.edu.ec/handle/123456789/49047,Ingeniería en Auditoría y Contaduría Pública Autorizada,Facultad de Ciencias Naturales y Matemáticas
Examen de auditoría realizada a las cuentas: Activos Fijos e Inventarios de una Institución Pública ubicada en la ciudad de Guayaquil,https://dspace.espol.edu.ec/handle/123456789/40107,Ingeniería en Auditoría y Contaduría Pública Autorizada,Facultad de Ciencias Naturales y Matemáticas
Diseño de un sistema de gestión en control operacional basado en la norma oshas 18001:2007 para el área administrativa de una sociedad financiera,https://dspace.espol.edu.ec/handle/123456789/38271,Ingeniería en Auditoría y Contaduría Pública Autorizada,Facultad de Ciencias Naturales y Matemáticas
Análisis financiero y tributario sectorial de la implementación de la niif 9 en las cuentas por cobrar de una empresa dedicada a la comercialización de maquinarias pesadas utilizadas para la construcción y minería.,https://dspace.espol.edu.ec/handle/123456789/48737,Ingeniería en Auditoría y Contaduría Pública Autorizada,Facultad de Ciencias Naturales y Matemáticas
Análisis tributario y financiero sectorial caso de estudio: operadores portuarios de carga del puerto marítimo de guayaquil.,https://dspace.espol.edu.ec/handle/123456789/39372,Ingeniería en Auditoría y Contaduría Pública Autorizada,Facultad de Ciencias Naturales y Matemáticas
Análisis de cumplimiento tributario correspondiente al periodo fiscal 2008 de una empresa comercial ubicada en la ciudad de Guayaquil dedicada en la compra y venta de artículos del hogar,https://dspace.espol.edu.ec/handle/123456789/36516,Ingeniería en Auditoría y Contaduría Pública Autorizada,Facultad de Ciencias Naturales y Matemáticas
"Diseño e implementación de un sistema de gestión para los procesos claves de una unidad educativa basado en un marco de referencia internacional, acerca de los estándares de calidad educativa, ubicada en la ciudad de guayaquil",https://dspace.espol.edu.ec/handle/123456789/52993,Ingeniería en Auditoría y Contaduría Pública Autorizada,Facultad de Ciencias Naturales y Matemáticas
Implementación de un sistema de gestión a través de indicadores que miden el desempeño en el área administrativa de una empresa cuya actividad económica es brindar servicios médicos,https://dspace.espol.edu.ec/handle/123456789/38339,Ingeniería en Auditoría y Contaduría Pública Autorizada,Facultad de Ciencias Naturales y Matemáticas
Diseño e implementacion de indicadores de gestion bajo la metodologia del cuadro de mando integral para la direcccion admionistrativa y financiera de una  institucion del sector publico,https://dspace.espol.edu.ec/handle/123456789/37164,Ingeniería en Auditoría y Contaduría Pública Autorizada,Facultad de Ciencias Naturales y Matemáticas
"Diseño de un sistema de control de gestión aplicado al área de contraloría de una empresa exportadora, para el logro de un mejoramiento continúo a través de indicadores de medición",https://dspace.espol.edu.ec/handle/123456789/39147,Ingeniería en Auditoría y Contaduría Pública Autorizada,Facultad de Ciencias Naturales y Matemáticas
Auditoría financiera aplicada al area de facturacion cuentas por cobrar cobranzas en una empresa dedicada a la compra y venta de vehiculos y repuestos localizada en la ciudad de Guayaquil año 2007,https://dspace.espol.edu.ec/handle/123456789/35178,Ingeniería en Auditoría y Contaduría Pública Autorizada,Facultad de Ciencias Naturales y Matemáticas
"Diseño de un sistema de control, aplicando la normativa BASC para una empresa de seguridad en la ciudad de Guayaquil",https://dspace.espol.edu.ec/handle/123456789/38081,Ingeniería en Auditoría y Contaduría Pública Autorizada,Facultad de Ciencias Naturales y Matemáticas
"Diseño de un sistema de gestión por proceso aplicada a una hacienda dedicada a la producción y comercialización de banano ubicada en el sector Costa Azul de la Vía Puerto Inca, La Troncal",https://dspace.espol.edu.ec/handle/123456789/38828,Ingeniería en Auditoría y Contaduría Pública Autorizada,Facultad de Ciencias Naturales y Matemáticas
Diseño y desarrollo de un manual de gestión para los procesos del área operativa aplicado a una consultora financiera en la ciudad de Guayaquil,https://dspace.espol.edu.ec/handle/123456789/54389,Ingeniería en Auditoría y Contaduría Pública Autorizada,Facultad de Ciencias Naturales y Matemáticas
Realizar el diseño de un plan de auditoría a la cuenta de efectivo de una empresa dedicada a la venta y prestación de servicios para eventos y fiestas infantiles ubicada en la ciudad de Guayaquil correspondiente al período fiscal 2011,https://dspace.espol.edu.ec/handle/123456789/39112,Ingeniería en Auditoría y Contaduría Pública Autorizada,Facultad de Ciencias Naturales y Matemáticas
"Diseño de un Sistema de Gestión de Calidad para el laboratorio de Bioproductos del Centro de Investigación en Biotecnología de una Institución de Educación Superior basado en el Servicio de Acreditación Ecuatoriano (SAE), ubicado en la ciudad de Guayaquil",https://dspace.espol.edu.ec/handle/123456789/54402,Ingeniería en Auditoría y Contaduría Pública Autorizada,Facultad de Ciencias Naturales y Matemáticas
"Diseño de un sistema de control de gestión aplicado al área administrativa de una empresa comercial, para la mejora administrativa y financiera, a través de indicadores medición",https://dspace.espol.edu.ec/handle/123456789/39034,Ingeniería en Auditoría y Contaduría Pública Autorizada,Facultad de Ciencias Naturales y Matemáticas
Matriz de evaluación a la dimensión y control de los factores críticos de riesgo referente a la prevención de lavado de activos en una entidad del sistema financiero,https://dspace.espol.edu.ec/handle/123456789/36419,Ingeniería en Auditoría y Contaduría Pública Autorizada,Facultad de Ciencias Naturales y Matemáticas
"Análisis del cumplimiento tributario, la gestión y control de las cuentas de gastos de una empresa que produce y comercializa fundas y zunchos para banano ubicada en el cantón Pascuales durante el ejercicio fiscal 2008",https://dspace.espol.edu.ec/handle/123456789/36505,Ingeniería en Auditoría y Contaduría Pública Autorizada,Facultad de Ciencias Naturales y Matemáticas
Diseño de un sistema de gestión por procesos para una empresa dedicada a la venta de insumos médicos y reactivos ubicada en la ciudad de Guayaquil.,https://dspace.espol.edu.ec/handle/123456789/39743,Ingeniería en Auditoría y Contaduría Pública Autorizada,Facultad de Ciencias Naturales y Matemáticas
Diseño de un manual para implementación de un sistema de gestión ambiental: ISO-14001 para una unidad educativa en la ciudad de Guayaquil,https://dspace.espol.edu.ec/handle/123456789/37140,Ingeniería en Auditoría y Contaduría Pública Autorizada,Facultad de Ciencias Naturales y Matemáticas
Diseño de un sistema de gestión por procesos para una compañía que brinda servicios de asesoría empresarial ubicada en la ciudad de Guayaquil,https://dspace.espol.edu.ec/handle/123456789/37718,Ingeniería en Auditoría y Contaduría Pública Autorizada,Facultad de Ciencias Naturales y Matemáticas
"Diseño e implementación de un sistema de gestión por procesos para una empresa dedicada a la elaboración de pan, ubicada en la ciudad de guayaquil",https://dspace.espol.edu.ec/handle/123456789/49232,Ingeniería en Auditoría y Contaduría Pública Autorizada,Facultad de Ciencias Naturales y Matemáticas
"Diseño de un sistema de gestión del proceso de administración del personal de la unidad de administración del talento humano de una institución de educación superior, ubicada en la ciudad de Guayaquil.",https://dspace.espol.edu.ec/handle/123456789/45067,Ingeniería en Auditoría y Contaduría Pública Autorizada,Facultad de Ciencias Naturales y Matemáticas
"Diseño de un sistema de control de gestión de materiales y personal, aplicado en una empresa constructora situada en la ciudad de Guayaquil.",https://dspace.espol.edu.ec/handle/123456789/39503,Ingeniería en Auditoría y Contaduría Pública Autorizada,Facultad de Ciencias Naturales y Matemáticas
Diseño de un sistema de gestión en control operacional basado en la norma OHSAS 18001:2007 para el departamento/procesos/área de operaciones,https://dspace.espol.edu.ec/handle/123456789/38272,Ingeniería en Auditoría y Contaduría Pública Autorizada,Facultad de Ciencias Naturales y Matemáticas
"Análisis de ingresos y gastos de una empresa dedicada a la compra/venta de equipos y productos de telefonía celular. sucursal: policentro, período 2006",https://dspace.espol.edu.ec/handle/123456789/35136,Ingeniería en Auditoría y Contaduría Pública Autorizada,Facultad de Ciencias Naturales y Matemáticas
Análisis económico y propuesta de conversión de la producción del banano convencional a banano orgánico,https://dspace.espol.edu.ec/handle/123456789/37869,Ingeniería en Auditoría y Contaduría Pública Autorizada,Facultad de Ciencias Naturales y Matemáticas
Análisis financiero y tributario sectorial de la implementación de la  niif 15 en una empresa del sector de telecomunicaciones.,https://dspace.espol.edu.ec/handle/123456789/48905,Ingeniería en Auditoría y Contaduría Pública Autorizada,Facultad de Ciencias Naturales y Matemáticas
