NOMBREPROYEC,URL,CARRERA,FACULTAD
Desarrollo de un marco muestral automatizado para la ciudad de Cuenca,https://dspace.espol.edu.ec/handle/123456789/4182,Ingeniería en Estadística Informática,Facultad de Ciencias Naturales y Matemáticas
Análisis socio-económico de las principales variables categóricas de la encuesta nacional de ingresos y gastos de los hogares del cantón Guayaquil 2011-2012,https://dspace.espol.edu.ec/handle/123456789/37705,Ingeniería en Estadística Informática,Facultad de Ciencias Naturales y Matemáticas
Estudio de los perfiles de los clientes de una compañía proveedora de bienes y servicios de impresión y fotocopiado. Un análisis univariado y multivariado,https://dspace.espol.edu.ec/handle/123456789/41287,Ingeniería en Estadística Informática,Facultad de Ciencias Naturales y Matemáticas
Diseño y elaboración de un sistema de información de los perfiles estadísticos de pacientes con enfermedades urológicas. Caso: ciudad de guayaquil,https://dspace.espol.edu.ec/handle/123456789/34553,Ingeniería en Estadística Informática,Facultad de Ciencias Naturales y Matemáticas
Desarrollo de un modelo estadístico para medir la posibilidad de morosidad de clientes en una empresa de retail,https://dspace.espol.edu.ec/handle/123456789/52454,Ingeniería en Estadística Informática,Facultad de Ciencias Naturales y Matemáticas
"Análisis estadístico de las características de una organización logística y de operaciones, para el desarrollo de un sistema de medición de indicadores de gestión bajo el esquema tarjetas de evaluación balanceadas",https://dspace.espol.edu.ec/handle/123456789/57344,Ingeniería en Estadística Informática,Facultad de Ciencias Naturales y Matemáticas
Determinación de índices de satisfacción de los clientes de la telefonía celular en la ciudad de Guayaquil,https://dspace.espol.edu.ec/handle/123456789/3965,Ingeniería en Estadística Informática,Facultad de Ciencias Naturales y Matemáticas
Análisis estadístico de la sustracción de vehiculos en la ciudad de Guayaquil año 1999,https://dspace.espol.edu.ec/handle/123456789/4109,Ingeniería en Estadística Informática,Facultad de Ciencias Naturales y Matemáticas
Evaluación de la calidad de la educación en las escuelas primarias en la ciudad de Guayaquil en los sectores municipales que constituyen ciudadelas y asentamientos de la Vía a Daule y la Vía a Salinas,https://dspace.espol.edu.ec/handle/123456789/40103,Ingeniería en Estadística Informática,Facultad de Ciencias Naturales y Matemáticas
Índice de natalidad del Ecuador mediante series temporales,https://dspace.espol.edu.ec/handle/123456789/4053,Ingeniería en Estadística Informática,Facultad de Ciencias Naturales y Matemáticas
Procedimientos estadísticos multivariados para el análisis de datos biológicos recopilados en el tiempo; sobre es desarrollo de una enfermedad foliar en banano y su relación con parámetros de clima,https://dspace.espol.edu.ec/handle/123456789/36321,Ingeniería en Estadística Informática,Facultad de Ciencias Naturales y Matemáticas
Análisis dinámicos de la estabilidad de variables macroeconómicas,https://dspace.espol.edu.ec/handle/123456789/41196,Ingeniería en Estadística Informática,Facultad de Ciencias Naturales y Matemáticas
Evaluación de la calidad y nivel de satisfacción de los servicios básicos en el sector norte de la parroquia febres cordero de la ciudad de Guayaquil,https://dspace.espol.edu.ec/handle/123456789/4038,Ingeniería en Estadística Informática,Facultad de Ciencias Naturales y Matemáticas
Plan estratégico y sostema de balanced scorecard para una empresa de venta por catálogo,https://dspace.espol.edu.ec/handle/123456789/36322,Ingeniería en Estadística Informática,Facultad de Ciencias Naturales y Matemáticas
Análisis estadístico de la oferta cultural en la ciudad de Guayaquil,https://dspace.espol.edu.ec/handle/123456789/37332,Ingeniería en Estadística Informática,Facultad de Ciencias Naturales y Matemáticas
Identificación de factores de siniestrabilidad laboral de una empresa dedicada a la producción de equipos eléctricos,https://dspace.espol.edu.ec/handle/123456789/36353,Ingeniería en Estadística Informática,Facultad de Ciencias Naturales y Matemáticas
Metodología para la evaluación de la capacidad de pago de un sujeto de crédito,https://dspace.espol.edu.ec/handle/123456789/4067,Ingeniería en Estadística Informática,Facultad de Ciencias Naturales y Matemáticas
Obtención del perfil de un cliente fiel en una tienda departamental mediante el diseño de un Data Warehouse y arboles de decisión,https://dspace.espol.edu.ec/handle/123456789/36370,Ingeniería en Estadística Informática,Facultad de Ciencias Naturales y Matemáticas
Las exportaciones del banano ecuatoriano en el contexto de las exportaciones mundiales de banano: un análisis estadístico,https://dspace.espol.edu.ec/handle/123456789/5714,Ingeniería en Estadística Informática,Facultad de Ciencias Naturales y Matemáticas
Censo de población y vivienda 2010: estadística sociodemográfica de la población nativa ecuatoriana,https://dspace.espol.edu.ec/handle/123456789/38761,Ingeniería en Estadística Informática,Facultad de Ciencias Naturales y Matemáticas
Personas en edad preuniversitaria según el censo 2010,https://dspace.espol.edu.ec/handle/123456789/38957,Ingeniería en Estadística Informática,Facultad de Ciencias Naturales y Matemáticas
Diseño experimental para el control del pardeamiento del banano tipo Cavendish en la elaboración de harina,https://dspace.espol.edu.ec/handle/123456789/3986,Ingeniería en Estadística Informática,Facultad de Ciencias Naturales y Matemáticas
Sistema automatizado de encuesta telefónicas para programas de televisión noticieros,https://dspace.espol.edu.ec/handle/123456789/5808,Ingeniería en Estadística Informática,Facultad de Ciencias Naturales y Matemáticas
Análisis estadístico y diseño de una base de datos del proceso de graduación de la ESPOL desde su fundación,https://dspace.espol.edu.ec/handle/123456789/4145,Ingeniería en Estadística Informática,Facultad de Ciencias Naturales y Matemáticas
Utilización de la metodología de gestión por procesos para el monitoreo de los procesos que se llevan a cabo en el departamento de distribución de una empresa de comunicación de prensa escrita en la ciudad de Guayaquil,https://dspace.espol.edu.ec/handle/123456789/36785,Ingeniería en Estadística Informática,Facultad de Ciencias Naturales y Matemáticas
Análisis estadístico de las causas de accidentes de tránsito en la ciudad de guayaquil,https://dspace.espol.edu.ec/handle/123456789/56132,Ingeniería en Estadística Informática,Facultad de Ciencias Naturales y Matemáticas
Análisis estadístico del posicionamiento de las carreras que oferta la ESPOL a nivel de pregrado en la ciudad de Guayaquil,https://dspace.espol.edu.ec/handle/123456789/41135,Ingeniería en Estadística Informática,Facultad de Ciencias Naturales y Matemáticas
Diseño e implementación de un sistema de control de procesos empresariales mediante la implementación de indicadores de gestión para el proceso de ventas de una empresa dedicada a la comercialización de suministros de limpieza e impresión ubicada en la ciudad de Guayaquil para el año 2009,https://dspace.espol.edu.ec/handle/123456789/36497,Ingeniería en Estadística Informática,Facultad de Ciencias Naturales y Matemáticas
Evaluación de la Calidad de la Educación en las Escuelas Primarias en la ciudad de Guayaquil en los sectores municipales que constituyen ciudadelas y asentamientos del Centro-Norte de la urbe,https://dspace.espol.edu.ec/handle/123456789/40104,Ingeniería en Estadística Informática,Facultad de Ciencias Naturales y Matemáticas
Análisis Estadístico Multivariante De Los Registros De La Corporación Aduanera Ecuatoriana. Región Costa,https://dspace.espol.edu.ec/handle/123456789/56688,Ingeniería en Estadística Informática,Facultad de Ciencias Naturales y Matemáticas
Modelización energética en el ecuador.,https://dspace.espol.edu.ec/handle/123456789/56760,Ingeniería en Estadística Informática,Facultad de Ciencias Naturales y Matemáticas
Investigación de mercado para las carreras de posgrados ofertadas por el Instituto de Ciencias Matemáticas. Estudios en la Ciudad de Guayaquil,https://dspace.espol.edu.ec/handle/123456789/40193,Ingeniería en Estadística Informática,Facultad de Ciencias Naturales y Matemáticas
Desestacionalización se series económicas de las cuentas nacionales del ecuador con X12 - ARIMA,https://dspace.espol.edu.ec/handle/123456789/56205,Ingeniería en Estadística Informática,Facultad de Ciencias Naturales y Matemáticas
Análisis estadístico exploratorio para la creación del área de trasplante renal en un hospital de la ciudad de Guayaquil,https://dspace.espol.edu.ec/handle/123456789/4137,Ingeniería en Estadística Informática,Facultad de Ciencias Naturales y Matemáticas
Análisis estadístico del nivel de conocimiento en matemáticas y lenguaje de los alumnos de décimo año de educación básica de los colegios fiscales rurales de Guayaquil,https://dspace.espol.edu.ec/handle/123456789/4122,Ingeniería en Estadística Informática,Facultad de Ciencias Naturales y Matemáticas
El recurso humano de la educación fiscal en el litoral ecuatoriano: un análisis estadístico,https://dspace.espol.edu.ec/handle/123456789/4005,Ingeniería en Estadística Informática,Facultad de Ciencias Naturales y Matemáticas
Evaluación de la Calidad de la Educación en las Escuelas Primarias de la ciudad de Guayaquil en los Sectores Municipales que constituyen el Centro Sur de la Urbe,https://dspace.espol.edu.ec/handle/123456789/56683,Ingeniería en Estadística Informática,Facultad de Ciencias Naturales y Matemáticas
Análisis estadístico del recurso humano en la educación fiscal de la provincia de Cotopaxi,https://dspace.espol.edu.ec/handle/123456789/4130,Ingeniería en Estadística Informática,Facultad de Ciencias Naturales y Matemáticas
La apertura de telecomunicaciones en el Ecuador. Una investigación de mercados para WLL (Wireless Local Loop),https://dspace.espol.edu.ec/handle/123456789/57658,Ingeniería en Estadística Informática,Facultad de Ciencias Naturales y Matemáticas
"Aplicación de análisis multivariado en la encuesta nacional de empleo, subempleo y desempleo (ENEMDU) del INEC, provincia de Pichincha aara los Años 2012 y 2013",https://dspace.espol.edu.ec/handle/123456789/30845,Ingeniería en Estadística Informática,Facultad de Ciencias Naturales y Matemáticas
Análisis estadístico de la migración ecuatoriana durante la década 1991 hasta 2000,https://dspace.espol.edu.ec/handle/123456789/4093,Ingeniería en Estadística Informática,Facultad de Ciencias Naturales y Matemáticas
Internet/internet para servicios educativos,https://dspace.espol.edu.ec/handle/123456789/4054,Ingeniería en Estadística Informática,Facultad de Ciencias Naturales y Matemáticas
Uso e implementación de métodos meta heurísticos de tipo recocido simulado en problemas de optimización duros,https://dspace.espol.edu.ec/handle/123456789/4096,Ingeniería en Estadística Informática,Facultad de Ciencias Naturales y Matemáticas
Estudios de los trastornos de la conducta alimentaria en la población estudiantil en la adolescencia temprana en la ciudad de Guayaquil,https://dspace.espol.edu.ec/handle/123456789/40090,Ingeniería en Estadística Informática,Facultad de Ciencias Naturales y Matemáticas
Análisis multivariante de la generación y producción en una termoelectrica de la ciudad de Esmeraldas,https://dspace.espol.edu.ec/handle/123456789/4148,Ingeniería en Estadística Informática,Facultad de Ciencias Naturales y Matemáticas
Valoración de opciones de compra y venta del quintal de soya en el mercado ecuatoriano,https://dspace.espol.edu.ec/handle/123456789/6929,Ingeniería en Estadística Informática,Facultad de Ciencias Naturales y Matemáticas
Análisis estadístico de los hábitos de navegación en internet de los estudiantes de la ESPOL,https://dspace.espol.edu.ec/handle/123456789/4113,Ingeniería en Estadística Informática,Facultad de Ciencias Naturales y Matemáticas
Análisis espacial de la intensidad de las enfermedades infectocontagiosas en Guayaquil,https://dspace.espol.edu.ec/handle/123456789/6090,Ingeniería en Estadística Informática,Facultad de Ciencias Naturales y Matemáticas
"Aplicación de métodos estadísticos multivariados en el estudio de calidad de enmiendas orgánicas sólidas y liquidas preparadas en las provincias del Guayas, Los Ríos y El Oro",https://dspace.espol.edu.ec/handle/123456789/39940,Ingeniería en Estadística Informática,Facultad de Ciencias Naturales y Matemáticas
"Estudio comparativo, por simulación de tecnicas de muestreo aleatorias y sistematicas",https://dspace.espol.edu.ec/handle/123456789/4021,Ingeniería en Estadística Informática,Facultad de Ciencias Naturales y Matemáticas
Optimización de la distribución de mercadería a las distintas sucursales de una empresa dedicada a la venta de aceites para autos,https://dspace.espol.edu.ec/handle/123456789/36367,Ingeniería en Estadística Informática,Facultad de Ciencias Naturales y Matemáticas
Cálculo actuarial con cadenas de Markov una aplicación,https://dspace.espol.edu.ec/handle/123456789/41711,Ingeniería en Estadística Informática,Facultad de Ciencias Naturales y Matemáticas
"La evaluación docente del profesorado de la ESPOL en la perspectiva del estudiante de ciencias económicas, administrativas y auditoria: ""CENACAD vs. sistema tradicional",https://dspace.espol.edu.ec/handle/123456789/37620,Ingeniería en Estadística Informática,Facultad de Ciencias Naturales y Matemáticas
Investigacion estadistica exploratoria del area de intoxicacion atendidas en los hospitales de guayaquil periodo 2001-2002,https://dspace.espol.edu.ec/handle/123456789/39649,Ingeniería en Estadística Informática,Facultad de Ciencias Naturales y Matemáticas
Análisis estadístico de los sistemas de información gerencial,https://dspace.espol.edu.ec/handle/123456789/4114,Ingeniería en Estadística Informática,Facultad de Ciencias Naturales y Matemáticas
Análisis estadístico multivariante de los registros de la corporación aduanera ecuatoriana región sierra,https://dspace.espol.edu.ec/handle/123456789/34561,Ingeniería en Estadística Informática,Facultad de Ciencias Naturales y Matemáticas
Análisis estadístico del recurso humano de la educación fiscal de la provincia de Loja,https://dspace.espol.edu.ec/handle/123456789/42145,Ingeniería en Estadística Informática,Facultad de Ciencias Naturales y Matemáticas
"Evaluación de la calidad de la educación en las escuelas primarias en el cantón samborondón, sector la puntilla",https://dspace.espol.edu.ec/handle/123456789/35157,Ingeniería en Estadística Informática,Facultad de Ciencias Naturales y Matemáticas
Intranet como herramienta para planificación académica,https://dspace.espol.edu.ec/handle/123456789/42139,Ingeniería en Estadística Informática,Facultad de Ciencias Naturales y Matemáticas
Análisis Espacial de la Distribución de la Delincuencia en Guayaquil,https://dspace.espol.edu.ec/handle/123456789/56659,Ingeniería en Estadística Informática,Facultad de Ciencias Naturales y Matemáticas
Un modelo de series temporales para el fenómeno de El Niño,https://dspace.espol.edu.ec/handle/123456789/5813,Ingeniería en Estadística Informática,Facultad de Ciencias Naturales y Matemáticas
Tecnicas estadísticas parametricas y no parametricas equivalentes: resultados comparativos por simulacion,https://dspace.espol.edu.ec/handle/123456789/4091,Ingeniería en Estadística Informática,Facultad de Ciencias Naturales y Matemáticas
Análisis estadístico exploratorio para abrir un área de cirugía cardiotorácica en un hospital de la ciudad de Guayaquil,https://dspace.espol.edu.ec/handle/123456789/40024,Ingeniería en Estadística Informática,Facultad de Ciencias Naturales y Matemáticas
Análisis estadístico exploratorio para la creación de un área de laboratorio de Endocrinología en un hospital de la ciudad de guayaquil caso: Hospital Naval de Guayaquil (HOSNAG),https://dspace.espol.edu.ec/handle/123456789/38841,Ingeniería en Estadística Informática,Facultad de Ciencias Naturales y Matemáticas
Análisis del efecto del crédito comercial con los agentes financieros en las pymes de la ciudad de Guayaquil,https://dspace.espol.edu.ec/handle/123456789/5839,Ingeniería en Estadística Informática,Facultad de Ciencias Naturales y Matemáticas
Análisis estadístico multivariante de las principales enfermedades gastroentericas de la ciudad de Guayaquil,https://dspace.espol.edu.ec/handle/123456789/4143,Ingeniería en Estadística Informática,Facultad de Ciencias Naturales y Matemáticas
Diseño e implementación de un algoritmo de tipo recocido simulado para la resolución del problema del agente viajero,https://dspace.espol.edu.ec/handle/123456789/35045,Ingeniería en Estadística Informática,Facultad de Ciencias Naturales y Matemáticas
Análisis espacial para medir el índice de infección de la Sigatoka Negra (Mycospphaerella Fijiensis) en una hacienda bananera en el último trimestre del año 2005,https://dspace.espol.edu.ec/handle/123456789/37352,Ingeniería en Estadística Informática,Facultad de Ciencias Naturales y Matemáticas
Análisis de mercado: necesidades habitacionales de los estudiantes de provincia que estudian en la ESPOL,https://dspace.espol.edu.ec/handle/123456789/3971,Ingeniería en Estadística Informática,Facultad de Ciencias Naturales y Matemáticas
Estudio para la ubicación optima de cajeros automáticos en la ciudad de Guayaquil,https://dspace.espol.edu.ec/handle/123456789/4033,Ingeniería en Estadística Informática,Facultad de Ciencias Naturales y Matemáticas
Utilización de la metodología seis sigma para reducir el tiempo de respuestas vía telefónica en la resolución de problemas sobre el manejo del sistema informático para clientes de una compañía de desarrollo de software en la ciudad de Guayaquil,https://dspace.espol.edu.ec/handle/123456789/10373,Ingeniería en Estadística Informática,Facultad de Ciencias Naturales y Matemáticas
El paso por la universidad de una cohorte de bachilleres: El caso ESPOL - 1975,https://dspace.espol.edu.ec/handle/123456789/40052,Ingeniería en Estadística Informática,Facultad de Ciencias Naturales y Matemáticas
Desarrollo de un modelo porcentual para la evaluación de sigatoka negra en condiciones de invernadero,https://dspace.espol.edu.ec/handle/123456789/35159,Ingeniería en Estadística Informática,Facultad de Ciencias Naturales y Matemáticas
Análisis estadístico del nivel de satisfacción de la metodología de enseñanza en matemáticas del pre-politécnico de ingeniería básica,https://dspace.espol.edu.ec/handle/123456789/5802,Ingeniería en Estadística Informática,Facultad de Ciencias Naturales y Matemáticas
Análisis Espacial de las Caracteristicas Económicas de las Comunas de la Península de Santa Elena,https://dspace.espol.edu.ec/handle/123456789/4059,Ingeniería en Estadística Informática,Facultad de Ciencias Naturales y Matemáticas
"Evaluación de la calidad y del nivel de satisfacción de los servicios básicos en la parroquia Tarqui, zona centro en la ciudad de Guayaquil",https://dspace.espol.edu.ec/handle/123456789/5952,Ingeniería en Estadística Informática,Facultad de Ciencias Naturales y Matemáticas
La supervisión estatal de la calidad de la educación: caso de los colegios fiscales del sector urbano del cantón Guayaquil,https://dspace.espol.edu.ec/handle/123456789/35154,Ingeniería en Estadística Informática,Facultad de Ciencias Naturales y Matemáticas
Diseño de un sistema de control de procesos empresariales basados en indicadores de gestión y desempeño para el proceso del secado de la madera en una empresa dedicada al procesamiento de madera ubicada en la ciudad de Quevedo para el primer semestre del 2010,https://dspace.espol.edu.ec/handle/123456789/38891,Ingeniería en Estadística Informática,Facultad de Ciencias Naturales y Matemáticas
Análisis geoestadístico de la distribución de plagas en el cultivo de mango. Caso de estudio: Granja experimental de Chongón (CEDEGE),https://dspace.espol.edu.ec/handle/123456789/4147,Ingeniería en Estadística Informática,Facultad de Ciencias Naturales y Matemáticas
Simulador Matemático del nuevo Sistema de Transporte Masivo de la ciudad de Guayaquil Troncal Terminal Guasmo – Terminal Río Daule,https://dspace.espol.edu.ec/handle/123456789/40347,Ingeniería en Estadística Informática,Facultad de Ciencias Naturales y Matemáticas
Análisis multivariante de las principales enfermedades tropicales de la ciudad de Guayaquil.,https://dspace.espol.edu.ec/handle/123456789/41524,Ingeniería en Estadística Informática,Facultad de Ciencias Naturales y Matemáticas
Simulador Matemático del Nuevo Sistema de Transporte Masivo para la Ciudad de Guayaquil Troncal Orquídeas Centro,https://dspace.espol.edu.ec/handle/123456789/4088,Ingeniería en Estadística Informática,Facultad de Ciencias Naturales y Matemáticas
Diseño y elaboración de un sistema de información para el manejo de historias clínicas de pacientes con càncer en los hospitales de la ciudad de Guayaquil,https://dspace.espol.edu.ec/handle/123456789/56613,Ingeniería en Estadística Informática,Facultad de Ciencias Naturales y Matemáticas
Análisis estadístico de la producción y el consumo de trigo en el Ecuador,https://dspace.espol.edu.ec/handle/123456789/56131,Ingeniería en Estadística Informática,Facultad de Ciencias Naturales y Matemáticas
Determinación de índices de desempeño de los aprendices de buceo profecional en base del análisis multivariado de sus carcterísticas físico-morfológicas,https://dspace.espol.edu.ec/handle/123456789/37339,Ingeniería en Estadística Informática,Facultad de Ciencias Naturales y Matemáticas
"Factores predictores de sobrevida en pacientes con diferentes patologías cancerosas, mediante el modelo de regresión de Cox. Caso: Estómago.",https://dspace.espol.edu.ec/handle/123456789/4046,Ingeniería en Estadística Informática,Facultad de Ciencias Naturales y Matemáticas
Optimización de un Portafolio de Inversiones Riesgosas Dentro de la Bolsa de Valores de Guayaquil,https://dspace.espol.edu.ec/handle/123456789/34319,Ingeniería en Estadística Informática,Facultad de Ciencias Naturales y Matemáticas
El recurso humano de la educación fiscal en la provincia de Manabí: un análisis estadístico,https://dspace.espol.edu.ec/handle/123456789/4008,Ingeniería en Estadística Informática,Facultad de Ciencias Naturales y Matemáticas
Selección de candidatos para encuestas mediante técnicas de machine learning,https://dspace.espol.edu.ec/handle/123456789/54068,Ingeniería en Estadística Informática,Facultad de Ciencias Naturales y Matemáticas
Determinación y uso de métodos estadísticos en la obtención de un modelo bioclimático para el manejo de la sigatoka negra presente en haciendas bananeras de la provincia del Guayas,https://dspace.espol.edu.ec/handle/123456789/35050,Ingeniería en Estadística Informática,Facultad de Ciencias Naturales y Matemáticas
Análisis de la variabilidad espacial de plagas en el cultivo de la caña de azúcar: Ingenio San Carlos,https://dspace.espol.edu.ec/handle/123456789/56126,Ingeniería en Estadística Informática,Facultad de Ciencias Naturales y Matemáticas
Diseño e implementación de un modelo explicativo de las causas de las horas de sobretiempo que tiene una empresa que maneja personal de servicio,https://dspace.espol.edu.ec/handle/123456789/3983,Ingeniería en Estadística Informática,Facultad de Ciencias Naturales y Matemáticas
"La Econometría Espacial en la Agricultura de Precisión:
Aplicación en un Ingenio Azucarero",https://dspace.espol.edu.ec/handle/123456789/40201,Ingeniería en Estadística Informática,Facultad de Ciencias Naturales y Matemáticas
Análisis Estadístico y Determinación de los Factores Asociados a la Mortalidad por Neumonía Adquirida en la Comunidad. Caso Hospital Militar de Guayaquil,https://dspace.espol.edu.ec/handle/123456789/41137,Ingeniería en Estadística Informática,Facultad de Ciencias Naturales y Matemáticas
Construcción de una tabla de mortalidad para la población ecuatoriana,https://dspace.espol.edu.ec/handle/123456789/4180,Ingeniería en Estadística Informática,Facultad de Ciencias Naturales y Matemáticas
Evaluación Cuantitativa del Sistema de Ciencia y Tecnología del Ecuador,https://dspace.espol.edu.ec/handle/123456789/4034,Ingeniería en Estadística Informática,Facultad de Ciencias Naturales y Matemáticas
Análisis  estadístico del recurso humano de la educación fiscal en la provincia del Carchi,https://dspace.espol.edu.ec/handle/123456789/4108,Ingeniería en Estadística Informática,Facultad de Ciencias Naturales y Matemáticas
Prueba piloto de autopsia verbal con enfoque covid-19 para los casos de no certificación medica en el cantón guayaquil  en el año 2020.,https://dspace.espol.edu.ec/handle/123456789/51952,Ingeniería en Estadística Informática,Facultad de Ciencias Naturales y Matemáticas
Estudio estadístico multivariante de la rehabilitación y protección al menor en la ciudad de Guayaquil,https://dspace.espol.edu.ec/handle/123456789/4031,Ingeniería en Estadística Informática,Facultad de Ciencias Naturales y Matemáticas
