NOMBREPROYEC,URL,CARRERA,FACULTAD
Propuesta metodológica para la aplicación del slope mass rating continuo (smr-c) mediante un sistema de información geográfica en los taludes de la vía la Moya Achupallas,https://dspace.espol.edu.ec/handle/123456789/32267,Geología,Facultad de Ingeniería en Ciencias de la Tierra
Caracterización geotécnica y evaluación del riesgo de deslizamiento en 3 puntos críticos presentes en la vía Matrama Mazar perteneciente a la provincia de Cañar,https://dspace.espol.edu.ec/handle/123456789/59495,Geología,Facultad de Ingeniería en Ciencias de la Tierra
Estudio geológico geotécnico del proyecto de presa baba,https://dspace.espol.edu.ec/handle/123456789/61981,Geología,Facultad de Ingeniería en Ciencias de la Tierra
Estudio geotécnico y geológico en las minas abandonadas de la concesión fict-1 para el prediseño de una mina escuela,https://dspace.espol.edu.ec/handle/123456789/54881,Geología,Facultad de Ingeniería en Ciencias de la Tierra
Estudio de las tobas azufradas del volcán Nevado del Chiles,https://dspace.espol.edu.ec/handle/123456789/3399,Geología,Facultad de Ingeniería en Ciencias de la Tierra
Evaluación y zonificación de riesgos geodinámicos en el distrito minero Zaruma - Portovelo.,https://dspace.espol.edu.ec/handle/123456789/8139,Geología,Facultad de Ingeniería en Ciencias de la Tierra
Enfoque geodinámico de la isla santa clara del golfo de Guayaquil,https://dspace.espol.edu.ec/handle/123456789/3393,Geología,Facultad de Ingeniería en Ciencias de la Tierra
Caracterización petrográfica mineralógica automatizada de rocas con potencial para almacenar Co2.,https://dspace.espol.edu.ec/handle/123456789/32283,Geología,Facultad de Ingeniería en Ciencias de la Tierra
Evaluación del geopatrimonio y su incidencia científico-social para la promoción del geoturismo parque nacional el cajas Ecuador,https://dspace.espol.edu.ec/handle/123456789/55513,Geología,Facultad de Ingeniería en Ciencias de la Tierra
"Estudio hidrogeológico de la cuenca baja del río Manglaralto provincia del guayas longitud oeste 80° 45' 00"" latitud sur 01° 51' 00"" longitud oeste 80° 36' 00""  latitud sur  01 ° 47' 00",https://dspace.espol.edu.ec/handle/123456789/3419,Geología,Facultad de Ingeniería en Ciencias de la Tierra
Prospección geotécnica de campo aplicada a la construcción de la presa del proyecto parque del conocimiento,https://dspace.espol.edu.ec/handle/123456789/14628,Geología,Facultad de Ingeniería en Ciencias de la Tierra
"Prospección geoquímica regional de sedimentos activos mediante el uso de la herramienta geostatistical analyst, en la zona noroccidental de la provincia de Chimborazo",https://dspace.espol.edu.ec/handle/123456789/30468,Geología,Facultad de Ingeniería en Ciencias de la Tierra
Análisis Estructural de la Cuenca Progreso- Secuencias Paleógeno.,https://dspace.espol.edu.ec/handle/123456789/36994,Geología,Facultad de Ingeniería en Ciencias de la Tierra
"Evaluación geológica, geomecánica y consideraciones para el prediseño de la estabilidad del talud del santuario blanca estrella del mar en el cerro de Olón, Santa Elena-Ecuador",https://dspace.espol.edu.ec/handle/123456789/54879,Geología,Facultad de Ingeniería en Ciencias de la Tierra
Evaluación de la resistencia a la abrasión de los miembros cayo s.s. y Guayaquil chert de la fm cayo,https://dspace.espol.edu.ec/handle/123456789/61864,Geología,Facultad de Ingeniería en Ciencias de la Tierra
"Geología del cuadrangulo 77° 45' 78°00' de longitud oeste y 01°10' -01°10' de latitud sur, escala 1:50.000 (área aproximada: 500 km^2, localizada en Puerto Napo, provincia de Napo.",https://dspace.espol.edu.ec/handle/123456789/3442,Geología,Facultad de Ingeniería en Ciencias de la Tierra
Modelo geológico-térmico de Guayaquil,https://dspace.espol.edu.ec/handle/123456789/29894,Geología,Facultad de Ingeniería en Ciencias de la Tierra
Análisis físico estadístico de propiedades geo-mecánicas de la formación cayo.,https://dspace.espol.edu.ec/handle/123456789/32461,Geología,Facultad de Ingeniería en Ciencias de la Tierra
"Evaluación de la disponibilidad hídrica basado en geoeléctrica y análisis de la calidad de agua en las lagunas de estabilización de la comuna Ayangue, Ecuador",https://dspace.espol.edu.ec/handle/123456789/57848,Geología,Facultad de Ingeniería en Ciencias de la Tierra
Estimación del riesgo sísmico y elaboración de plan de mitigación en la zona centro del Cantón Eloy Alfaro (Durán),https://dspace.espol.edu.ec/handle/123456789/54872,Geología,Facultad de Ingeniería en Ciencias de la Tierra
Aplicación de la teledetección en el mapeo geológico de una parte de la costa del ecuador utilizando una sub estación de landsat tm y técnicas específicas de tratamiento de morfología matemática,https://dspace.espol.edu.ec/handle/123456789/61875,Geología,Facultad de Ingeniería en Ciencias de la Tierra
Zonas de alteración y mineralización de un depósito de poli sulfuros en rocas metamórficas paleozoicas en la región de bailadores,https://dspace.espol.edu.ec/handle/123456789/3352,Geología,Facultad de Ingeniería en Ciencias de la Tierra
"Estudio Para La Definición De Posibles Áreas De Explotación De Materiales Pétreos De Sectores Poblados De Santa Cruz, Galápagos",https://dspace.espol.edu.ec/handle/123456789/46775,Geología,Facultad de Ingeniería en Ciencias de la Tierra
"El flujo de trabajo de modelamiento geológico en petrel aplicación práctica en un campo de la Cuenca Oriente, Ecuador",https://dspace.espol.edu.ec/handle/123456789/55034,Geología,Facultad de Ingeniería en Ciencias de la Tierra
Estudio de evaluación geológica de una arena de la parte oeste del campo Magallanes,https://dspace.espol.edu.ec/handle/123456789/61887,Geología,Facultad de Ingeniería en Ciencias de la Tierra
Geología y Petrografía Del Depósito De Cobre-Molibdeno De Chaucha,https://dspace.espol.edu.ec/handle/123456789/44493,Geología,Facultad de Ingeniería en Ciencias de la Tierra
Análisis De Procesos y Peligros Geológicos Alrededor De La Estación Científica Pedro Vicente Maldonado En La Isla Greenwich-Antártida,https://dspace.espol.edu.ec/handle/123456789/47484,Geología,Facultad de Ingeniería en Ciencias de la Tierra
Estudio Estratigráfico y Petrográfico de Ignimbritas en San Pedro al Suroeste Del Canton Santa Isabel provincia Del Azuay.,https://dspace.espol.edu.ec/handle/123456789/43675,Geología,Facultad de Ingeniería en Ciencias de la Tierra
"Caracterización De Los Minerales De Alteración Hidrotermal En La Zona Comprendida Entre las Quebradas Chorrera Chico y El Bicundo, Proyecto La Bonita, Sucumbíos-Ecuador",https://dspace.espol.edu.ec/handle/123456789/43492,Geología,Facultad de Ingeniería en Ciencias de la Tierra
Análisis de estabilidad de taludes en la autopista  Azogues-Cuenca y en la vía Matrama-Mazaren la provincia de Cañar,https://dspace.espol.edu.ec/handle/123456789/63117,Geología,Facultad de Ingeniería en Ciencias de la Tierra
Propuesta geoparque ruta del oro basada en especificaciones unesco: aspectos geológicos provincia de el Oro - Ecuador,https://dspace.espol.edu.ec/handle/123456789/55522,Geología,Facultad de Ingeniería en Ciencias de la Tierra
"Estudio Geológico, Geomecánico y Su Incidencia En La Evaluación De La Estabilidad De Talud Del Cementerio Patrimonial General (Puerta 1), Cerro Del Carmen, Guayaquil",https://dspace.espol.edu.ec/handle/123456789/48822,Geología,Facultad de Ingeniería en Ciencias de la Tierra
Evaluación de la vulnerabilidad intrínseca a la contaminación mediante técnicas multivariables en el acuífero costero de Olón,https://dspace.espol.edu.ec/handle/123456789/65924,Geología,Facultad de Ingeniería en Ciencias de la Tierra
Estudio geotécnico de factibilidad del sitio de la presa Zapotal.,https://dspace.espol.edu.ec/handle/123456789/32483,Geología,Facultad de Ingeniería en Ciencias de la Tierra
Análisis de estabilidad de las rocas del borde costero de la zona de La Chocolatera y La Lobería (Salinas) utilizando fotogrametría y clasificación geomecánica de macizos rocosos.,https://dspace.espol.edu.ec/handle/123456789/57874,Geología,Facultad de Ingeniería en Ciencias de la Tierra
Estudio mineralúrgico para la extracción de oro por cianuración de los relaves de Ponce Enriquez,https://dspace.espol.edu.ec/handle/123456789/3421,Geología,Facultad de Ingeniería en Ciencias de la Tierra
Modelo socio-hidrogeológico aplicado a la gestión sostenible del agua en la junta administradora de agua potable regional Valdivia (Santa Elena- Ecuador),https://dspace.espol.edu.ec/handle/123456789/52343,Geología,Facultad de Ingeniería en Ciencias de la Tierra
Determinación de sedimentos (azolves) en la presa Chongón,https://dspace.espol.edu.ec/handle/123456789/3377,Geología,Facultad de Ingeniería en Ciencias de la Tierra
Diseño de Modelo Estratigráfico de las Formaciones Cuaternarias del Sector Septentrional de la Cuenca Baja del Guayas.,https://dspace.espol.edu.ec/handle/123456789/38907,Geología,Facultad de Ingeniería en Ciencias de la Tierra
"Inspección técnica de la presa santa Marta, mediante medidas subacuáticas de potencial espontaneo",https://dspace.espol.edu.ec/handle/123456789/44654,Geología,Facultad de Ingeniería en Ciencias de la Tierra
Geología aplicada para la gestión del agua en la comunidad de El Arenal – Volcán Chimborazo – Provincia de Bolívar,https://dspace.espol.edu.ec/handle/123456789/52336,Geología,Facultad de Ingeniería en Ciencias de la Tierra
Revisión de estado de conocimientos del fenómeno de dispersividad de los suelos y aporte de una nueva metodología recomendada para detectar arcillas dispersas,https://dspace.espol.edu.ec/handle/123456789/58073,Geología,Facultad de Ingeniería en Ciencias de la Tierra
"Caracterización geoquímica y petrográfica de filones hidrotermales del distrito minero Zaruma-portovelo, Ecuador",https://dspace.espol.edu.ec/handle/123456789/51412,Geología,Facultad de Ingeniería en Ciencias de la Tierra
Recuperación de oro de las arenas de la mina san-José: método de cianuración por agitación,https://dspace.espol.edu.ec/handle/123456789/32506,Geología,Facultad de Ingeniería en Ciencias de la Tierra
Desarrollo de una metodología para la ordenación minero-ambiental en el sector de Zaruma-Portovelo,https://dspace.espol.edu.ec/handle/123456789/8149,Geología,Facultad de Ingeniería en Ciencias de la Tierra
"Análisis petrográfico de los cerros de bellavista y San Eduardo,  Guayaquil, Ecuador",https://dspace.espol.edu.ec/handle/123456789/52338,Geología,Facultad de Ingeniería en Ciencias de la Tierra
Modelado de deslizamiento utilizando técnicas de sensores remotos: Caso de estudio vía a la Costa-Guayas.,https://dspace.espol.edu.ec/handle/123456789/65923,Geología,Facultad de Ingeniería en Ciencias de la Tierra
Prospección minera de cobre en la zona de monte nuevo,https://dspace.espol.edu.ec/handle/123456789/3338,Geología,Facultad de Ingeniería en Ciencias de la Tierra
Estudio composicional de los sedimentos marinos de la ensenada de Jaramijo Provincia de Manabí,https://dspace.espol.edu.ec/handle/123456789/60987,Geología,Facultad de Ingeniería en Ciencias de la Tierra
Geología y tectónica del área del golfo de Santa Fe,https://dspace.espol.edu.ec/handle/123456789/3308,Geología,Facultad de Ingeniería en Ciencias de la Tierra
Operaciones de perforación y completaciones en un área del oriente Ecuatoriano,https://dspace.espol.edu.ec/handle/123456789/7918,Geología,Facultad de Ingeniería en Ciencias de la Tierra
"Caracterización geológica y geotécnica de un movimiento en masa en el sector Nueva Prosperina, Guayaquil - Ecuador",https://dspace.espol.edu.ec/handle/123456789/57876,Geología,Facultad de Ingeniería en Ciencias de la Tierra
Estimación del índice de peligrosidad de los volcanes potencialmente activos del Ecuador,https://dspace.espol.edu.ec/handle/123456789/63114,Geología,Facultad de Ingeniería en Ciencias de la Tierra
Exploración de Aguas Subterráneas en Cadeate Para el Abastecimiento de la Comunidad.,https://dspace.espol.edu.ec/handle/123456789/35243,Geología,Facultad de Ingeniería en Ciencias de la Tierra
"Modelo Estructural Del Área Denominada Enami 25, Proyecto De Exploración Minera La Bonita, Mediante la Interpretación de Anaglifos Elaborados Sobre Modelo Digital De Elevación y Ortofotos Escala 1:5.000",https://dspace.espol.edu.ec/handle/123456789/43674,Geología,Facultad de Ingeniería en Ciencias de la Tierra
Elaboración de un modelo de susceptibilidad frente a deslizamientos en el área urbana de Guayaquil,https://dspace.espol.edu.ec/handle/123456789/63115,Geología,Facultad de Ingeniería en Ciencias de la Tierra
Geología de los Cerros de Duran,https://dspace.espol.edu.ec/handle/123456789/58301,Geología,Facultad de Ingeniería en Ciencias de la Tierra
Estudios geológicos de una cuenca sedimentaria de los carbones del austro: Loja-Ecuador,https://dspace.espol.edu.ec/handle/123456789/44364,Geología,Facultad de Ingeniería en Ciencias de la Tierra
Evaluación del Balance sedimentario de las Cuencas Hidrográficas de Zapotal y Jipijapa hacia la zona litoral,https://dspace.espol.edu.ec/handle/123456789/51086,Geología,Facultad de Ingeniería en Ciencias de la Tierra
Aplicación de sensores remotos en el estudio de áreas propicias para la prospección de aguas subterráneas en la zona occidental de Loja.,https://dspace.espol.edu.ec/handle/123456789/45304,Geología,Facultad de Ingeniería en Ciencias de la Tierra
Carta de zonificación geotécnica de la cuenca de drenaje de la presa de Zapotal.,https://dspace.espol.edu.ec/handle/123456789/32458,Geología,Facultad de Ingeniería en Ciencias de la Tierra
Aglomeración de partículas previo a la percolación de las arenas del sector  la independencia,https://dspace.espol.edu.ec/handle/123456789/3306,Geología,Facultad de Ingeniería en Ciencias de la Tierra
"Terremoto de Esmeraldas del 12 de diciembre de 1979, Mw=8.2: Inversión de datos hidrográficos para obtener sus características de ruptura",https://dspace.espol.edu.ec/handle/123456789/32242,Geología,Facultad de Ingeniería en Ciencias de la Tierra
Estudio metalogenético preliminar de la zona charazani callinzani,https://dspace.espol.edu.ec/handle/123456789/61954,Geología,Facultad de Ingeniería en Ciencias de la Tierra
"Aplicación Del Método de Difracción Para la Determinación y Cuantificación de Minerales de Alteración Hidrotermal Del Sondaje TEL-01 Del Proyecto Telimbela, su Relación Con la Litología y Mineralización.",https://dspace.espol.edu.ec/handle/123456789/37133,Geología,Facultad de Ingeniería en Ciencias de la Tierra
Aplicación de los métodos de resistividades en la exploración de aguas subterráneas en la zona Engabao - Playa,https://dspace.espol.edu.ec/handle/123456789/58057,Geología,Facultad de Ingeniería en Ciencias de la Tierra
Geología petrolera de los campos tigre - tablazo - la fe - san joaquin - emporio - certeza - santo tomas,https://dspace.espol.edu.ec/handle/123456789/44494,Geología,Facultad de Ingeniería en Ciencias de la Tierra
Caracterización geológica de nuevas fuentes de aprovechamiento de material pétreo en el sector urbano de la isla Santa Cruz - Galápagos,https://dspace.espol.edu.ec/handle/123456789/59496,Geología,Facultad de Ingeniería en Ciencias de la Tierra
Correlaciones y análisis geológicos entre muestras de dragas recolectadas durante la campaña Amadeus (2005) y muestras de tierra tomadas entre jama y esmeraldas,https://dspace.espol.edu.ec/handle/123456789/61958,Geología,Facultad de Ingeniería en Ciencias de la Tierra
Uso de Radiolarios como indicadores de fluctuaciones cálidas y frías del Océano Pacífico Ecuatorial Oriental durante el Holoceno,https://dspace.espol.edu.ec/handle/123456789/57873,Geología,Facultad de Ingeniería en Ciencias de la Tierra
Vulnerabilidad sísmica de viviendas populares asentadas en cerros y en el sur de la ciudad de Guayaquil,https://dspace.espol.edu.ec/handle/123456789/51469,Geología,Facultad de Ingeniería en Ciencias de la Tierra
Comportamiento hidrogeológico del cono de deyección del río Chimbo.,https://dspace.espol.edu.ec/handle/123456789/32456,Geología,Facultad de Ingeniería en Ciencias de la Tierra
Investigación geológico - geotécnica parala construcción de una represa en el río Valdivia,https://dspace.espol.edu.ec/handle/123456789/44519,Geología,Facultad de Ingeniería en Ciencias de la Tierra
Recopilación de información base para el mapa geoambiental del área urbana del gran Guayaquil y mapas en formato sig,https://dspace.espol.edu.ec/handle/123456789/3341,Geología,Facultad de Ingeniería en Ciencias de la Tierra
Exploración de geofísica aplicada a la hidrogeología en los recintos san juan y san pablo de la Parroquia Cascol  Manabí,https://dspace.espol.edu.ec/handle/123456789/57875,Geología,Facultad de Ingeniería en Ciencias de la Tierra
Modelo geológico del yacimiento “viche congüime 3” para la determinación de su valor económico,https://dspace.espol.edu.ec/handle/123456789/7808,Geología,Facultad de Ingeniería en Ciencias de la Tierra
Geología para los estudios de prefactibilidad de la presa Salanguillo,https://dspace.espol.edu.ec/handle/123456789/32507,Geología,Facultad de Ingeniería en Ciencias de la Tierra
Geología y geotecnia de la represa Daule - Peripa.  estudios definitivos,https://dspace.espol.edu.ec/handle/123456789/32486,Geología,Facultad de Ingeniería en Ciencias de la Tierra
Análisis multitemporal de los cambios de cauce en la confluencia entre el río Coca y río Napo desde 2016 al 2022,https://dspace.espol.edu.ec/handle/123456789/59339,Geología,Facultad de Ingeniería en Ciencias de la Tierra
"Caracterización mineralógica del depósito de zeolitas naturales en el río Guaraguau (Isidro Ayora, Provincia del Guayas) y su aplicación en la remoción de amonio en aguas residuales.",https://dspace.espol.edu.ec/handle/123456789/24645,Geología,Facultad de Ingeniería en Ciencias de la Tierra
Revisión del estado de conocimientos del fenómeno de dispersividad de los suelos y aporte de una nueva metodología recomendada para detectar arcillas dispersivas,https://dspace.espol.edu.ec/handle/123456789/58118,Geología,Facultad de Ingeniería en Ciencias de la Tierra
Estudios geológicos y geotécnicos para la construcción de la presa Daule - Peripa,https://dspace.espol.edu.ec/handle/123456789/3427,Geología,Facultad de Ingeniería en Ciencias de la Tierra
"Calculo de reservas de la veta ""paraíso"" mina paraíso-distrito Ponce Enríquez",https://dspace.espol.edu.ec/handle/123456789/24770,Geología,Facultad de Ingeniería en Ciencias de la Tierra
Caracterización y evaluación de la cuenca alta del rio santa rosa,https://dspace.espol.edu.ec/handle/123456789/61975,Geología,Facultad de Ingeniería en Ciencias de la Tierra
"Geomorfología fluvial y análisis multitemporal del río Bajaña, Los Ríos - Ecuador",https://dspace.espol.edu.ec/handle/123456789/52341,Geología,Facultad de Ingeniería en Ciencias de la Tierra
Características geomecánicas de los suelos encontrados en el sistema de riego y drenaje de 17.000 has. en el valle del río Daule y su utilización en la construcción de terraplenes,https://dspace.espol.edu.ec/handle/123456789/3360,Geología,Facultad de Ingeniería en Ciencias de la Tierra
"Análisis geológico estructural de la mina r-nivel en el área cebral, huertas, distrito Zaruma, Ecuador",https://dspace.espol.edu.ec/handle/123456789/52330,Geología,Facultad de Ingeniería en Ciencias de la Tierra
Análisis geotécnico de inestabilidades y propuesta de sostenimiento de taludes en dos sitios críticos de la vía Guangarcucho – Paute – Gualaceo,https://dspace.espol.edu.ec/handle/123456789/54873,Geología,Facultad de Ingeniería en Ciencias de la Tierra
Estudio geológico y petrológico de una aureola de contacto producida por un cuerpo granítico y sus efectos en los depósitos de sulfuros masivos de la región de bailadores (Estado Merida – Venezuela).,https://dspace.espol.edu.ec/handle/123456789/3417,Geología,Facultad de Ingeniería en Ciencias de la Tierra
La sísmica de reflexión y su aplicación en la interpretación en una cuenca petrolífera (ríoja-cameros),https://dspace.espol.edu.ec/handle/123456789/3319,Geología,Facultad de Ingeniería en Ciencias de la Tierra
"Implicaciones geológicas y geomorfológicas del valle del río Upano y el puente de la vía Macas – Puyo, Morona Santiago, Ecuador",https://dspace.espol.edu.ec/handle/123456789/52328,Geología,Facultad de Ingeniería en Ciencias de la Tierra
Evaluación geológica del cuerpo mineralizado soledad,https://dspace.espol.edu.ec/handle/123456789/6559,Geología,Facultad de Ingeniería en Ciencias de la Tierra
Caracterización geológica y geoquímica del sector minero Bella Rica (Ponce Enríquez),https://dspace.espol.edu.ec/handle/123456789/57849,Geología,Facultad de Ingeniería en Ciencias de la Tierra
"Propuesta de metodología constructiva de pozo caso:Salida de emergencia del tramo labrador-carcelén del metro de Quito, Ecuador",https://dspace.espol.edu.ec/handle/123456789/48813,Geología,Facultad de Ingeniería en Ciencias de la Tierra
Reconstrucción Paleogeográfica Del Paleógeno de la Cuenca Progreso Reconstrucción Paleogeográfica de Los Sedimentos Eocénicos Depositados en Las Zonas de Ancón y Anconcito.,https://dspace.espol.edu.ec/handle/123456789/37143,Geología,Facultad de Ingeniería en Ciencias de la Tierra
Actualización de la información estratigráfica y bioestratigráfica del Pozo Ricaurte 1 en la Cuenca de Manabí desde el Eoceno hasta el Plioceno,https://dspace.espol.edu.ec/handle/123456789/57872,Geología,Facultad de Ingeniería en Ciencias de la Tierra
Influencia de los lados emulsionados de bajo contenido de cal en la rata de penetración de pozos profundos,https://dspace.espol.edu.ec/handle/123456789/32472,Geología,Facultad de Ingeniería en Ciencias de la Tierra
Estudio mineralurgico para la recuperación de estibina  yacimiento loma larga,https://dspace.espol.edu.ec/handle/123456789/61979,Geología,Facultad de Ingeniería en Ciencias de la Tierra
"Metodología para modelar datos de corte y relleno de la sección del terraplén de una carretera, mediante un sistema de información geográfica",https://dspace.espol.edu.ec/handle/123456789/24773,Geología,Facultad de Ingeniería en Ciencias de la Tierra
Estudios geológicos y geotécnicos para la construcción de la presa Daule - Peripa,https://dspace.espol.edu.ec/handle/123456789/44280,Geología,Facultad de Ingeniería en Ciencias de la Tierra
Estudios geotécnicos de la derivadora Mocache en el río Vinces.,https://dspace.espol.edu.ec/handle/123456789/32482,Geología,Facultad de Ingeniería en Ciencias de la Tierra
Control de suelos expansivos en el área Tosagua.,https://dspace.espol.edu.ec/handle/123456789/44589,Geología,Facultad de Ingeniería en Ciencias de la Tierra
"La Geología y Potencial Mineral De La Cordillera Real, Ecuador.",https://dspace.espol.edu.ec/handle/123456789/44376,Geología,Facultad de Ingeniería en Ciencias de la Tierra
Aplicación de la geoeléctrica para la caracterización hidrogeológica en la comuna la Aguadita Santa Elena,https://dspace.espol.edu.ec/handle/123456789/55512,Geología,Facultad de Ingeniería en Ciencias de la Tierra
Estudio de la concentración natural y artificial de arenas negras en General Villamil Playas,https://dspace.espol.edu.ec/handle/123456789/3398,Geología,Facultad de Ingeniería en Ciencias de la Tierra
Estudio de deslizamiento en el embalse de la presa libertad,https://dspace.espol.edu.ec/handle/123456789/61996,Geología,Facultad de Ingeniería en Ciencias de la Tierra
Modelamiento estratigráfico de la arenisca u por ciclos sedimentarios menores en el área meridional del campo Sacha,https://dspace.espol.edu.ec/handle/123456789/48810,Geología,Facultad de Ingeniería en Ciencias de la Tierra
Continuación de las investigaciones geológicas y cartografiado regional,https://dspace.espol.edu.ec/handle/123456789/61997,Geología,Facultad de Ingeniería en Ciencias de la Tierra
Estudio de factibilidad geológico geotécnica para la construcción de una represa en el río Valdivia.,https://dspace.espol.edu.ec/handle/123456789/32465,Geología,Facultad de Ingeniería en Ciencias de la Tierra
Recuperación de oro de relaves utilizando mera concentradora y cianuración por agitación.,https://dspace.espol.edu.ec/handle/123456789/3342,Geología,Facultad de Ingeniería en Ciencias de la Tierra
"Estudio estratigráfico de la formación Angostura en los cortes del cerro la Mona (1) y el río Cascol (2)  provincia de Manabí.  (1) coordenadas (LONG. oeste 80° 33' 17"" lat. sur. 1° 21' 43"" )  (LONG. Oeste 80° 33' 21"" Lat. Sur. 1° 21' 47"" ) ( 2) Coordenadas (LONG. Oeste 80° 27' 17"" Lat. Sur. 1° 39' 5"" ) (LONG. Oeste 80° 27' 32"" Lat. Sur. 1° 40' 7"" ).",https://dspace.espol.edu.ec/handle/123456789/32460,Geología,Facultad de Ingeniería en Ciencias de la Tierra
Caracterización Geológica del cerro curiurcu para la construcción de un túnel carretero en la vía Guaguarcucho-Paute-Gualaceo,https://dspace.espol.edu.ec/handle/123456789/54882,Geología,Facultad de Ingeniería en Ciencias de la Tierra
"Estudio geológico de los campos petroleros Matilde-Carmela, península de Santa Elena y sus posibilidades de desarrollo petrolero",https://dspace.espol.edu.ec/handle/123456789/44460,Geología,Facultad de Ingeniería en Ciencias de la Tierra
Estudio Geológico  Minero y evaluación económica Preliminar Del Yacimiento Mineral De Kumurana (Potosi - Bolivia),https://dspace.espol.edu.ec/handle/123456789/44488,Geología,Facultad de Ingeniería en Ciencias de la Tierra
