NOMBREPROYEC,URL,CARRERA,FACULTAD
Estudios de espectros inelásticos y factores de reducción para la ciudad de Guayaquil,https://dspace.espol.edu.ec/handle/123456789/3425,Ingeniería Civil,Facultad de Ingeniería en Ciencias de la Tierra
Diseño Del Sistema de Evacuación de Aguas Servidas y Planta de Tratamiento Para Beneficio Del Recinto la Barranca Samborondón.,https://dspace.espol.edu.ec/handle/123456789/36517,Ingeniería Civil,Facultad de Ingeniería en Ciencias de la Tierra
Estudios preliminares y diseño de la vía km.76 (Guayaquil - Santa Elena) – olmedo,https://dspace.espol.edu.ec/handle/123456789/6129,Ingeniería Civil,Facultad de Ingeniería en Ciencias de la Tierra
Estudios y Diseños De Soluciones Para Resolver Los Problemas Geotécnicos Existentes En El dique Seco De ASENABRA S.A.,https://dspace.espol.edu.ec/handle/123456789/46907,Ingeniería Civil,Facultad de Ingeniería en Ciencias de la Tierra
Diseño y modelado estructural de una vivienda unifamiliar de bahareque encementado,https://dspace.espol.edu.ec/handle/123456789/52212,Ingeniería Civil,Facultad de Ingeniería en Ciencias de la Tierra
Diseño de una edificación de uso múltiple para la Casa Hogar Perpetuo Socorro.,https://dspace.espol.edu.ec/handle/123456789/65911,Ingeniería Civil,Facultad de Ingeniería en Ciencias de la Tierra
"Análisis Del Potencial De Licuefacción En La Ptar Las Esclusas, Guasmo Sur-Guayaquil",https://dspace.espol.edu.ec/handle/123456789/46695,Ingeniería Civil,Facultad de Ingeniería en Ciencias de la Tierra
"Estudio de factibilidad del paso lateral jipijapa, de 6.5 km (aprox.), incluye intercambiador de tráfico para conexión con una futura autopista.",https://dspace.espol.edu.ec/handle/123456789/30379,Ingeniería Civil,Facultad de Ingeniería en Ciencias de la Tierra
Estudio de prefactibilidad para la construcción de un puente carrozable en el recinto Boca de Guabito del cantón Colimes,https://dspace.espol.edu.ec/handle/123456789/54905,Ingeniería Civil,Facultad de Ingeniería en Ciencias de la Tierra
Diseño De Un Complejo Turístico En Puerto López Con Soluciones Para El Manejo Ambiental,https://dspace.espol.edu.ec/handle/123456789/46644,Ingeniería Civil,Facultad de Ingeniería en Ciencias de la Tierra
Comparativa estructural y análisis de impacto ambiental de una vivienda en Guayaquil utilizando ladrillos de hormigón convencional y hormigón alivianado,https://dspace.espol.edu.ec/handle/123456789/52211,Ingeniería Civil,Facultad de Ingeniería en Ciencias de la Tierra
Control de calidad en obra del material usado en la construcción de la estructura del pavimento flexible,https://dspace.espol.edu.ec/handle/123456789/14616,Ingeniería Civil,Facultad de Ingeniería en Ciencias de la Tierra
Rehabilitación y Saneamiento Del Rio Chicharrón,https://dspace.espol.edu.ec/handle/123456789/36433,Ingeniería Civil,Facultad de Ingeniería en Ciencias de la Tierra
Diseño estructural de una residencia de dos plantas en Aires de Batan,https://dspace.espol.edu.ec/handle/123456789/57833,Ingeniería Civil,Facultad de Ingeniería en Ciencias de la Tierra
Diseño para la implementación de reductores de velocidad de caucho reciclado  para la pacificación de tránsito en el anillo vial del Campus Prosperina Espol,https://dspace.espol.edu.ec/handle/123456789/63124,Ingeniería Civil,Facultad de Ingeniería en Ciencias de la Tierra
Diseño estructural de un edificio de 4 niveles en el Oriente ecuatoriano,https://dspace.espol.edu.ec/handle/123456789/59565,Ingeniería Civil,Facultad de Ingeniería en Ciencias de la Tierra
Metodología para la implementación de un sistema de gestión de obras basado en el estudio de productividades de dos proyectos de construcción,https://dspace.espol.edu.ec/handle/123456789/54477,Ingeniería Civil,Facultad de Ingeniería en Ciencias de la Tierra
"Rediseño de un tramo de carretera L=800 m. que involucra la curva horizontal ubicada en el Km 1,7 entre Progreso y Playas de la vía colectora Nobol-Posorja E-489, para reducir los siniestros de tránsito",https://dspace.espol.edu.ec/handle/123456789/63138,Ingeniería Civil,Facultad de Ingeniería en Ciencias de la Tierra
Análisis de la operación de los humedales de flujo subsuperficial en la remoción de contaminantes ambientales.,https://dspace.espol.edu.ec/handle/123456789/30968,Ingeniería Civil,Facultad de Ingeniería en Ciencias de la Tierra
Análisis hidrologico de la cuenca del cerro colorado y su interacción con la autopista terminal terrestre -Pascuales,https://dspace.espol.edu.ec/handle/123456789/3307,Ingeniería Civil,Facultad de Ingeniería en Ciencias de la Tierra
"Diseño de una residencia campestre empleando materiales  sostenibles, ubicado en la parroquia Chongón, provincia del  Guayas.",https://dspace.espol.edu.ec/handle/123456789/60759,Ingeniería Civil,Facultad de Ingeniería en Ciencias de la Tierra
Diseño estructural de un condominio multifamiliar de tres pisos en la etapa topacio de la urbanización “La Joya” con muros estructurales,https://dspace.espol.edu.ec/handle/123456789/51478,Ingeniería Civil,Facultad de Ingeniería en Ciencias de la Tierra
Evaluación de la influencia de la interacción suelo - estructura en la respuesta sísmica de edificación una tipo comercial en Ecuador.,https://dspace.espol.edu.ec/handle/123456789/59581,Ingeniería Civil,Facultad de Ingeniería en Ciencias de la Tierra
Consolidación por precarga de suelos altamente compresibles en la ciudad de Durán,https://dspace.espol.edu.ec/handle/123456789/65903,Ingeniería Civil,Facultad de Ingeniería en Ciencias de la Tierra
Estudio y diseño de la presa colinar en Sacachún #1,https://dspace.espol.edu.ec/handle/123456789/52205,Ingeniería Civil,Facultad de Ingeniería en Ciencias de la Tierra
Avaluó de los predios del campus Ingeniero. Gustavo Galindo Velasco: Edificio #40; Edificio #46 (copol); Edificio #60; Edificio #61; Edificio #62; Edificio #63 (fimcm),https://dspace.espol.edu.ec/handle/123456789/38343,Ingeniería Civil,Facultad de Ingeniería en Ciencias de la Tierra
"Alternativa De Viviendas Sismo Resistentes Tipo Domo Como Solución Habitacional Para Personas de Escasos Recursos De La Poblacion De Canoa, San Vicente, Manabi",https://dspace.espol.edu.ec/handle/123456789/42470,Ingeniería Civil,Facultad de Ingeniería en Ciencias de la Tierra
Estudio de factibilidad para la implementación del manejo de residuos sólidos en una obra civil campamento Atahualpa,https://dspace.espol.edu.ec/handle/123456789/3396,Ingeniería Civil,Facultad de Ingeniería en Ciencias de la Tierra
Diseño de una nave industrial destinada al almacenamiento de congelados usando metodología BIM,https://dspace.espol.edu.ec/handle/123456789/59563,Ingeniería Civil,Facultad de Ingeniería en Ciencias de la Tierra
Uso de sílice en hormigones de alto desempeño,https://dspace.espol.edu.ec/handle/123456789/8676,Ingeniería Civil,Facultad de Ingeniería en Ciencias de la Tierra
Estudio y diseño hidrosanitario del proyecto Puerto Santa Ana-Guayaquil,https://dspace.espol.edu.ec/handle/123456789/58426,Ingeniería Civil,Facultad de Ingeniería en Ciencias de la Tierra
"Diseño de factibilidad de ampliación y rehabilitación, en áreas inundables, del actual relleno sanitario de Durán",https://dspace.espol.edu.ec/handle/123456789/51533,Ingeniería Civil,Facultad de Ingeniería en Ciencias de la Tierra
Estudio de prefactibilidad para el diseño de un relleno sanitario en la provincia de Santa Elena con afectación de la población flotante,https://dspace.espol.edu.ec/handle/123456789/54966,Ingeniería Civil,Facultad de Ingeniería en Ciencias de la Tierra
Análisis de la situación actual y solución para mejorar la red de abastecimiento y distribución del agua potable del cantón Caluma,https://dspace.espol.edu.ec/handle/123456789/48201,Ingeniería Civil,Facultad de Ingeniería en Ciencias de la Tierra
Aplicación de procesos biológicos como medida remediación para recuperar suelos limo-arcillosos contaminados con gasolina.,https://dspace.espol.edu.ec/handle/123456789/16491,Ingeniería Civil,Facultad de Ingeniería en Ciencias de la Tierra
Mantenimiento de la capa de rodadura de concreto asfaltico en un pavimento flexible,https://dspace.espol.edu.ec/handle/123456789/19121,Ingeniería Civil,Facultad de Ingeniería en Ciencias de la Tierra
Estudios y Diseños Definitivos De La Infraestructura Deportiva En La Ciudadela La Yolita Del Cantón Daule,https://dspace.espol.edu.ec/handle/123456789/46191,Ingeniería Civil,Facultad de Ingeniería en Ciencias de la Tierra
Proceso constructivo de una capa de rodadura con hormigón compactado con pavimentadora (HCP),https://dspace.espol.edu.ec/handle/123456789/14626,Ingeniería Civil,Facultad de Ingeniería en Ciencias de la Tierra
Diseño de una estructura sismo resistente de dos pisos para un Centro de Salud en la Universidad Técnica de Manabí de la ciudad de Portoviejo,https://dspace.espol.edu.ec/handle/123456789/51454,Ingeniería Civil,Facultad de Ingeniería en Ciencias de la Tierra
Diseño de Mezclas para Hormigón Autocompactante,https://dspace.espol.edu.ec/handle/123456789/8150,Ingeniería Civil,Facultad de Ingeniería en Ciencias de la Tierra
Diseño de ingenierías de una vivienda de 2 pisos en Ciudad Celeste con  automatización de instalaciones empleando la metodología BIM,https://dspace.espol.edu.ec/handle/123456789/60757,Ingeniería Civil,Facultad de Ingeniería en Ciencias de la Tierra
"Soluciones de Ingeniería Para el Sistema de Abastecimiento de Agua Potable y Evacuación de las Aguas Residuales de la Comuna Febres Cordero, Parroquia Colonche, Cantón Santa Elena, Provincia de Santa Elena",https://dspace.espol.edu.ec/handle/123456789/35103,Ingeniería Civil,Facultad de Ingeniería en Ciencias de la Tierra
Diseño de una red de distribución de agua potable en la parroquia urbana San Pedro de Guanujo en el cantón Guaranda,https://dspace.espol.edu.ec/handle/123456789/52234,Ingeniería Civil,Facultad de Ingeniería en Ciencias de la Tierra
Prediseño De La Presa La Camarona Ubicada En El Campus Gustavo Galindo De La Espol,https://dspace.espol.edu.ec/handle/123456789/46703,Ingeniería Civil,Facultad de Ingeniería en Ciencias de la Tierra
"Análisis de los desechos sólidos de construcción generados en 2 obras civiles ubicadas en la ciudad de Guayaquil, provincia del Guayas.",https://dspace.espol.edu.ec/handle/123456789/30782,Ingeniería Civil,Facultad de Ingeniería en Ciencias de la Tierra
Estudio Y Diseño Para La Ampliación De La Unidad Educativa Réplica Eugenio Espejo En La Ciudad De Babahoyo,https://dspace.espol.edu.ec/handle/123456789/36437,Ingeniería Civil,Facultad de Ingeniería en Ciencias de la Tierra
"Estudio de la gestión de desechos solidos en el canton puerto baquerizo moreno (isla San Cristóbal, provincia de Galápagos)",https://dspace.espol.edu.ec/handle/123456789/6562,Ingeniería Civil,Facultad de Ingeniería en Ciencias de la Tierra
"Diseño sismo resistente, con instalaciones de servicios básicos, de una edificación de dos plantas en el suburbio oeste de Guayaquil",https://dspace.espol.edu.ec/handle/123456789/51472,Ingeniería Civil,Facultad de Ingeniería en Ciencias de la Tierra
"Implementación y análisis de cimentación de un tanque de 1200 galones para un sistema contra incendios en la terminal de productos limpios tres bocas, localizada en la ciudad de Guayaquil",https://dspace.espol.edu.ec/handle/123456789/30977,Ingeniería Civil,Facultad de Ingeniería en Ciencias de la Tierra
"Soluciones de Ingeniería Para el Aprovechamiento Urbanístico de un Terreno de 60 m de Ancho por 2000 m De Longitud, Ubicado al Pie de los Cerros Chongón",https://dspace.espol.edu.ec/handle/123456789/35109,Ingeniería Civil,Facultad de Ingeniería en Ciencias de la Tierra
Metodología para reducción de pérdidas técnicas en el  sistema de distribución de AA.PP. del suburbio oeste de la  ciudad de Guayaquil,https://dspace.espol.edu.ec/handle/123456789/54805,Ingeniería Civil,Facultad de Ingeniería en Ciencias de la Tierra
Estudios y diseños de presa colinar en la hacienda la bendición comuna sacachún provincia de Santa Elena,https://dspace.espol.edu.ec/handle/123456789/54939,Ingeniería Civil,Facultad de Ingeniería en Ciencias de la Tierra
Diagnóstico De Situación y Propuestas De Solución a Inundaciones En El Sector El Recreo – Durán,https://dspace.espol.edu.ec/handle/123456789/46949,Ingeniería Civil,Facultad de Ingeniería en Ciencias de la Tierra
"Diseño de un condominio sol y mar de tres plantas, incluye área social y parqueos, ubicado en el Cantón Salinas de la provincia de Santa Elena",https://dspace.espol.edu.ec/handle/123456789/51549,Ingeniería Civil,Facultad de Ingeniería en Ciencias de la Tierra
Reparación y Reforzamiento de Los Muros de Mampostería Aplicado a la Unidad de Flagrancia en la av. de Las Américas de la Ciudad de Guayaquil.,https://dspace.espol.edu.ec/handle/123456789/37058,Ingeniería Civil,Facultad de Ingeniería en Ciencias de la Tierra
Estudios y diseños del sistema de agua potable en el recinto las cochas cantón Guaranda,https://dspace.espol.edu.ec/handle/123456789/55474,Ingeniería Civil,Facultad de Ingeniería en Ciencias de la Tierra
"Control y vigilancia de una obra de ingeniería civil: experiencia concreta de la estación de agua residual de Meulan Les Mureaux, especificaciones de obras de contención, interfase con la parte equipamiento.",https://dspace.espol.edu.ec/handle/123456789/3373,Ingeniería Civil,Facultad de Ingeniería en Ciencias de la Tierra
Metodología para reducción de pérdidas técnicas en el sistema de distribución de aa.pp. del suburbio oeste de la ciudad de Guayaquil,https://dspace.espol.edu.ec/handle/123456789/6561,Ingeniería Civil,Facultad de Ingeniería en Ciencias de la Tierra
"Diseño Estructural Y Elaboración De Manual De Alternativa Constructiva De Viviendas De Ayuda Social, Sismo Resistentes En Terrazas Aluviales De Diferente Compactación.",https://dspace.espol.edu.ec/handle/123456789/43497,Ingeniería Civil,Facultad de Ingeniería en Ciencias de la Tierra
Rediseño de la Planta Depuradora de Aguas Residuales en  la comunidad Santa María del Fiat - Olón,https://dspace.espol.edu.ec/handle/123456789/60728,Ingeniería Civil,Facultad de Ingeniería en Ciencias de la Tierra
Metodología de la construcción de la estructura del edificio Giardini Boutique Hotel Suites & Residences.,https://dspace.espol.edu.ec/handle/123456789/30057,Ingeniería Civil,Facultad de Ingeniería en Ciencias de la Tierra
Evaluación y Diseño del reforzamiento estructural de la Casa de Gobierno del GAD del Cantón Chillanes,https://dspace.espol.edu.ec/handle/123456789/57840,Ingeniería Civil,Facultad de Ingeniería en Ciencias de la Tierra
"Soluciones Ingenieriles Para el Desarrollo de Una Urbanización en Chone, Parroquia Ricaurte Afectada por Sismos",https://dspace.espol.edu.ec/handle/123456789/38951,Ingeniería Civil,Facultad de Ingeniería en Ciencias de la Tierra
Avaluo de Los Predios Del Campus Ing. Gustavo Galindo Velasco: Anexo General- Especificaciones Tecnicas y Análisis de Precios Unitarios.,https://dspace.espol.edu.ec/handle/123456789/32457,Ingeniería Civil,Facultad de Ingeniería en Ciencias de la Tierra
Revisión de dimensiones mínimas de diseño de pórticos de acero estructural con perfiles doblados en frío.,https://dspace.espol.edu.ec/handle/123456789/30725,Ingeniería Civil,Facultad de Ingeniería en Ciencias de la Tierra
Evaluación económica y análisis del proceso constructivo de la presa de embalse en el parque del conocimiento,https://dspace.espol.edu.ec/handle/123456789/58916,Ingeniería Civil,Facultad de Ingeniería en Ciencias de la Tierra
"Análisis, diseño y presupuesto de una estructura de dos pisos: Centro tecnológico minero",https://dspace.espol.edu.ec/handle/123456789/38342,Ingeniería Civil,Facultad de Ingeniería en Ciencias de la Tierra
Diseño de un relleno Sanitario para la gestión segura de residuos sólidos urbanos en la parroquia Anconcito cantón Salinas provincia Santa Elena,https://dspace.espol.edu.ec/handle/123456789/65916,Ingeniería Civil,Facultad de Ingeniería en Ciencias de la Tierra
Evaluación y remodelación de edificio rectorado para certificación EDGE,https://dspace.espol.edu.ec/handle/123456789/55457,Ingeniería Civil,Facultad de Ingeniería en Ciencias de la Tierra
Diseño de un material a base de cemento y ceniza en la aplicación de reparación de vías,https://dspace.espol.edu.ec/handle/123456789/57906,Ingeniería Civil,Facultad de Ingeniería en Ciencias de la Tierra
Diseño de hormigón utilizando materiales extraídos de canteras locales en la provincia de Galápagos,https://dspace.espol.edu.ec/handle/123456789/59576,Ingeniería Civil,Facultad de Ingeniería en Ciencias de la Tierra
Soluciones técnicas para detener el peligroso avance erosivo y destructivo en sectores críticos del río Caluma en la comuna de Charquiyacu,https://dspace.espol.edu.ec/handle/123456789/57786,Ingeniería Civil,Facultad de Ingeniería en Ciencias de la Tierra
"Control en agregados y hormigón fresco para diseño de hormigón masivo, experiencia en obra con varias consistencias y resistencias",https://dspace.espol.edu.ec/handle/123456789/8132,Ingeniería Civil,Facultad de Ingeniería en Ciencias de la Tierra
"Diseño estructural de una vivienda de dos pisos con sistema constructivo Steel Framing ubicada en Curia, provincia de Santa Elena",https://dspace.espol.edu.ec/handle/123456789/57836,Ingeniería Civil,Facultad de Ingeniería en Ciencias de la Tierra
"Estudio y pre-diseño para un nuevo puente, sobre el río salinas, ubicado en el ingreso de la ciudad de Guaranda, provincia del Bolívar.",https://dspace.espol.edu.ec/handle/123456789/50423,Ingeniería Civil,Facultad de Ingeniería en Ciencias de la Tierra
"Detección de patologías y propuestas de mejora para el sistema de agua potable existente en la parroquia El Reventador, cantón Gonzalo Pizarro, provincia de Sucumbíos",https://dspace.espol.edu.ec/handle/123456789/59559,Ingeniería Civil,Facultad de Ingeniería en Ciencias de la Tierra
Uso de humedales artificiales superficiales para remoción de contaminantes industriales.,https://dspace.espol.edu.ec/handle/123456789/30736,Ingeniería Civil,Facultad de Ingeniería en Ciencias de la Tierra
"Diseño de un sistema sostenible de depuración de aguas residuales para la  comunidad de San Cristóbal, Cantón Paute, Provincia del Azuay.",https://dspace.espol.edu.ec/handle/123456789/63121,Ingeniería Civil,Facultad de Ingeniería en Ciencias de la Tierra
Diseño de la mezcla de bloques sostenibles utilizando residuos de caña de azúcar y su implementación en proyectos residenciales,https://dspace.espol.edu.ec/handle/123456789/59525,Ingeniería Civil,Facultad de Ingeniería en Ciencias de la Tierra
Análisis de contaminación y propuesta de Soluciones Técnicas en Punta Blanca,https://dspace.espol.edu.ec/handle/123456789/54453,Ingeniería Civil,Facultad de Ingeniería en Ciencias de la Tierra
"Diseño de la ampliación de la casa de retiros ¨LA SALLE¨, ubicada en  Playas.",https://dspace.espol.edu.ec/handle/123456789/60740,Ingeniería Civil,Facultad de Ingeniería en Ciencias de la Tierra
Valoración y análisis técnico en la búsqueda de soluciones para el aprovechamiento del lago de ingenierías de la ESPOL,https://dspace.espol.edu.ec/handle/123456789/57838,Ingeniería Civil,Facultad de Ingeniería en Ciencias de la Tierra
"Cierre Técnico del Relleno Sanitario del Cantón Salinas, Determinación de Soluciones a Nivel de Pre Factibilidad",https://dspace.espol.edu.ec/handle/123456789/32107,Ingeniería Civil,Facultad de Ingeniería en Ciencias de la Tierra
Diseño estructural de una UPC en Tenguel: Edificio de 2 niveles para personal policial.,https://dspace.espol.edu.ec/handle/123456789/65899,Ingeniería Civil,Facultad de Ingeniería en Ciencias de la Tierra
"Estudios y Diseños para la construcción del Hospital de Caluma, provincia Bolívar",https://dspace.espol.edu.ec/handle/123456789/57908,Ingeniería Civil,Facultad de Ingeniería en Ciencias de la Tierra
"Avalúo de los predios del campus ing. Gustavo Galindo Velasco: facultad de Ingeniería Mecánica bloques 17, 18 A-B-C, 24 C 57. Vías de acceso principales y secundarias.",https://dspace.espol.edu.ec/handle/123456789/3356,Ingeniería Civil,Facultad de Ingeniería en Ciencias de la Tierra
"Influencia de la contaminación por vertientes industriales terrestres sobre el río Guayas en la Grilla de latitud 02"" 12' Sur - 02"" 14' sur entre la ciudad de Guayaquil y la Isla Santay.",https://dspace.espol.edu.ec/handle/123456789/3314,Ingeniería Civil,Facultad de Ingeniería en Ciencias de la Tierra
Mejoramiento de Las Condiciones Estructurales en Edificios de Hormigón armado Aplicando Tecnología frp (Fiber Reinforced Polymer),https://dspace.espol.edu.ec/handle/123456789/39958,Ingeniería Civil,Facultad de Ingeniería en Ciencias de la Tierra
Diseño De Base Estabilizada Con Asfaltita Para Su Aplicación En Vías Terciarias De La Provincia De Napo,https://dspace.espol.edu.ec/handle/123456789/46686,Ingeniería Civil,Facultad de Ingeniería en Ciencias de la Tierra
Estudio de prefactibilidad para el diseño de la repotenciación del mercado de Lomas de Sargentillo,https://dspace.espol.edu.ec/handle/123456789/54904,Ingeniería Civil,Facultad de Ingeniería en Ciencias de la Tierra
Rehabilitación sísmica de viviendas de hormigón armado no dúctiles localizadas en sectores populares de Guayaquil - Fase 2,https://dspace.espol.edu.ec/handle/123456789/51543,Ingeniería Civil,Facultad de Ingeniería en Ciencias de la Tierra
Diseño paramétrico de viviendas de hasta dos niveles utilizando SAP 2000 y AutoCAD,https://dspace.espol.edu.ec/handle/123456789/59574,Ingeniería Civil,Facultad de Ingeniería en Ciencias de la Tierra
Análisis y diseño de optimización del sistema depurador de aguas residuales de la Zona 2 y 4 de ESPOL,https://dspace.espol.edu.ec/handle/123456789/52220,Ingeniería Civil,Facultad de Ingeniería en Ciencias de la Tierra
Diseño del puente sobre la quebrada Tomabela para cruzar la vía de desvío del tráfico pesado en la ciudad de Guaranda,https://dspace.espol.edu.ec/handle/123456789/51531,Ingeniería Civil,Facultad de Ingeniería en Ciencias de la Tierra
Hormigón visto en estructura: proceso constructivo y acabado final.,https://dspace.espol.edu.ec/handle/123456789/13343,Ingeniería Civil,Facultad de Ingeniería en Ciencias de la Tierra
Diseño de un pavimento rígido con pavimento asfáltico reciclado como  sustituto del agregado grueso en la Ruta del Cacao,https://dspace.espol.edu.ec/handle/123456789/60764,Ingeniería Civil,Facultad de Ingeniería en Ciencias de la Tierra
Diseño estructural sismoresistente de una plaza comercial en la parroquia Tarqui – Manta,https://dspace.espol.edu.ec/handle/123456789/52407,Ingeniería Civil,Facultad de Ingeniería en Ciencias de la Tierra
"Análisis estructural y geotécnico, propuesta de soluciones aplicables a la iglesia matriz de san josé de chimbo, afectada por el sismo de 6 septiembre 2018

.",https://dspace.espol.edu.ec/handle/123456789/48154,Ingeniería Civil,Facultad de Ingeniería en Ciencias de la Tierra
Implementación de criterios de sustentabilidad de acuerdo a los parámetros de certificación Leed para viviendas 2008 en un conjunto residencial de la Vía a la Costa,https://dspace.espol.edu.ec/handle/123456789/30467,Ingeniería Civil,Facultad de Ingeniería en Ciencias de la Tierra
"Evaluación y diagnóstico del sistema de abastecimiento de agua potable en la parroquia Juan Bautista Aguirre, sector los tintos, cantón Daule - provincia del Guayas",https://dspace.espol.edu.ec/handle/123456789/52226,Ingeniería Civil,Facultad de Ingeniería en Ciencias de la Tierra
"Diseño de sistema avanzado de tratamiento de electrodiálisis para la  remoción de As en agua de consumo doméstico en la ciudad de Santa Rosa,  Ecuador",https://dspace.espol.edu.ec/handle/123456789/60745,Ingeniería Civil,Facultad de Ingeniería en Ciencias de la Tierra
Diseño de un dique en el río Olón para el aprovechamiento hídrico de la comuna en el sector El Bosque,https://dspace.espol.edu.ec/handle/123456789/59535,Ingeniería Civil,Facultad de Ingeniería en Ciencias de la Tierra
"Propuesta para la repotenciación de sistema de bombeo, línea de impulsión y lagunas de estabilización en la zona urbana del cantón Junín - Manabí – Ecuador",https://dspace.espol.edu.ec/handle/123456789/51538,Ingeniería Civil,Facultad de Ingeniería en Ciencias de la Tierra
Diseño óptimo de un sistema estructural sismorresistente y sanitario para una  edificación multiuso de 3 pisos en la provincia de Santa Elena,https://dspace.espol.edu.ec/handle/123456789/60752,Ingeniería Civil,Facultad de Ingeniería en Ciencias de la Tierra
"Diseño estructural de un condominio de uso residencial, cimentado sobre suelo potencialmente licuable, localizado en Punta Carnero, Salinas - Ecuador",https://dspace.espol.edu.ec/handle/123456789/54906,Ingeniería Civil,Facultad de Ingeniería en Ciencias de la Tierra
Rediseño de tramo de carretera de L=500 metros afectada por socavones laterales y  hundimientos de la calzada en la vía Jipijapa-Cascol KM 75 sector las Cañitas,https://dspace.espol.edu.ec/handle/123456789/63122,Ingeniería Civil,Facultad de Ingeniería en Ciencias de la Tierra
Cálculo y análisis de diagrama de masas para construir la subrasante de un proyecto vial,https://dspace.espol.edu.ec/handle/123456789/24786,Ingeniería Civil,Facultad de Ingeniería en Ciencias de la Tierra
Análisis Estructural Y Respuesta Sísmica Del Edificio Torre 4 Del Estadio Capwell - Estudio De Métodos De Protección Sísmica Para La Estructura,https://dspace.espol.edu.ec/handle/123456789/36442,Ingeniería Civil,Facultad de Ingeniería en Ciencias de la Tierra
