NOMBREPROYEC,URL,CARRERA,FACULTAD
Software para el calculo de volumen de movimiento de tierra y software para calculo de pórticos de varios pisos por el método de G. Kani's,https://dspace.espol.edu.ec/handle/123456789/44421,Ingeniería Civil,Facultad de Ingeniería en Ciencias de la Tierra
Análisis comparativo de metodologías de diseño para una vivienda de interés social en Guayaquil,https://dspace.espol.edu.ec/handle/123456789/63151,Ingeniería Civil,Facultad de Ingeniería en Ciencias de la Tierra
"Diseño de un dique en el río Manglaralto, en el sector próximo a la extensión universitaria UPSE para la recarga del acuífero",https://dspace.espol.edu.ec/handle/123456789/59568,Ingeniería Civil,Facultad de Ingeniería en Ciencias de la Tierra
Determinación de curvas de sedimentación utilizando reactor experimental tipo columna,https://dspace.espol.edu.ec/handle/123456789/32269,Ingeniería Civil,Facultad de Ingeniería en Ciencias de la Tierra
"Alternativas de Diseño de Hormigones Fluidos, Estables y de Alta Resistencia para Diferentes Problemas en la Ingeniería Civil.",https://dspace.espol.edu.ec/handle/123456789/39472,Ingeniería Civil,Facultad de Ingeniería en Ciencias de la Tierra
Diseño de Sistema de Evacuación de Aguas Lluvias para el Sector de Urbanor como Alternativa para Mitigar los Efectos del Invierno.,https://dspace.espol.edu.ec/handle/123456789/38824,Ingeniería Civil,Facultad de Ingeniería en Ciencias de la Tierra
Diseño de dique para embalsar y lograr la recarga subterránea en el valle Cadeate y diseño de un embalse tipo para una finca,https://dspace.espol.edu.ec/handle/123456789/51696,Ingeniería Civil,Facultad de Ingeniería en Ciencias de la Tierra
Diseño del sistema de tratamiento de aguas residuales generadas en el cantón Durán,https://dspace.espol.edu.ec/handle/123456789/29880,Ingeniería Civil,Facultad de Ingeniería en Ciencias de la Tierra
"Diseño de una represa en el río El Palmar, Santa Elena, para el aprovechamiento y  sostenibilidad del agua en la estación experimental del CENAIM",https://dspace.espol.edu.ec/handle/123456789/60732,Ingeniería Civil,Facultad de Ingeniería en Ciencias de la Tierra
Revisión de dimensión mínimas de diseño para pórticos de hormigón armado según la norma ecuatoriana de la construcción 2011.,https://dspace.espol.edu.ec/handle/123456789/30638,Ingeniería Civil,Facultad de Ingeniería en Ciencias de la Tierra
"Revestimiento de canales abiertos de conducción de agua, con polietileno de alta densidad. aplicación: trasvase Daule - santa Elena.",https://dspace.espol.edu.ec/handle/123456789/43935,Ingeniería Civil,Facultad de Ingeniería en Ciencias de la Tierra
Diseño de la ampliación de vivienda utilizando metodología BIM  empleando soluciones sostenibles para alcanzar la certificación EDGE,https://dspace.espol.edu.ec/handle/123456789/60731,Ingeniería Civil,Facultad de Ingeniería en Ciencias de la Tierra
Propiedades mecánicas de un diseño de hormigón compactado con pavimentación y fast track trabajando en conjunto,https://dspace.espol.edu.ec/handle/123456789/8688,Ingeniería Civil,Facultad de Ingeniería en Ciencias de la Tierra
Diseño estructural de Reservorio para Campus Gustavo Galindo ESPOL,https://dspace.espol.edu.ec/handle/123456789/60726,Ingeniería Civil,Facultad de Ingeniería en Ciencias de la Tierra
Diseño de terraplenes sobre suelos compresibles para la línea ferroviaria de alta  velocidad Salerno-Reggio Calabria en Italia,https://dspace.espol.edu.ec/handle/123456789/63129,Ingeniería Civil,Facultad de Ingeniería en Ciencias de la Tierra
Diseño de la vía espol-prosperina,https://dspace.espol.edu.ec/handle/123456789/61990,Ingeniería Civil,Facultad de Ingeniería en Ciencias de la Tierra
Rediseño de una estructura de tres niveles conformada por distintos tipos de muros estructurales ubicada en la urbanización Villa Club,https://dspace.espol.edu.ec/handle/123456789/59573,Ingeniería Civil,Facultad de Ingeniería en Ciencias de la Tierra
"Plan maestro de agua potable, alcantarillado sanitario y pluvial para ESPOL",https://dspace.espol.edu.ec/handle/123456789/52189,Ingeniería Civil,Facultad de Ingeniería en Ciencias de la Tierra
Diseño de Mejoramiento y Ampliación de la Vía la Libertad Ballenita a Nivel de Prefactibilidad Ubicada en la Provincia de Santa Elena.,https://dspace.espol.edu.ec/handle/123456789/36522,Ingeniería Civil,Facultad de Ingeniería en Ciencias de la Tierra
"Control De Inundaciones Y Diseño De Soluciones Viales Especiales En La Población De Ayangue, Cantón Santa Elena",https://dspace.espol.edu.ec/handle/123456789/43450,Ingeniería Civil,Facultad de Ingeniería en Ciencias de la Tierra
Proyecto estructural e hidrosanitario de residencia unifamiliar en Portoviejo,https://dspace.espol.edu.ec/handle/123456789/63119,Ingeniería Civil,Facultad de Ingeniería en Ciencias de la Tierra
"Solución para asentamientos y tiempos de consolidación en el proyecto ""paso lateral de salitre"", mediante el método de precarga",https://dspace.espol.edu.ec/handle/123456789/30973,Ingeniería Civil,Facultad de Ingeniería en Ciencias de la Tierra
Análisis Hidráulico de las Estructuras de Drenaje Pluvial de la Facultad de Economía y Negocios (FEN) en el Campus Gustavo Galindo de la ESPOL,https://dspace.espol.edu.ec/handle/123456789/24658,Ingeniería Civil,Facultad de Ingeniería en Ciencias de la Tierra
Análisis De Comportamiento Estructural De Una Vivienda De Interés Social Del Suburbio Oeste De La Ciudad De Guayaquil Y Propuesta De Soluciones,https://dspace.espol.edu.ec/handle/123456789/43543,Ingeniería Civil,Facultad de Ingeniería en Ciencias de la Tierra
Rediseño de calles secundarias L= 800m de pavimento flexible construidos en suelos arcillosos en la Zona 1 del Cantón La Libertad provincia de Santa Elena,https://dspace.espol.edu.ec/handle/123456789/65915,Ingeniería Civil,Facultad de Ingeniería en Ciencias de la Tierra
Estudio y diseño para embalsar aguas lluvias y dotación de agua potable en la comuna de Ayangue,https://dspace.espol.edu.ec/handle/123456789/51436,Ingeniería Civil,Facultad de Ingeniería en Ciencias de la Tierra
"Diseño de galpones para uso de bodegas con su sistema de aguas sanitarias en la parroquia rural Los Lojas, cantón Daule.",https://dspace.espol.edu.ec/handle/123456789/50425,Ingeniería Civil,Facultad de Ingeniería en Ciencias de la Tierra
Determinación de la resistencia del hormigón en obra a partir de la madurez y estudio de factibilidad en su implementación basándonos en la correlación temperatura – tiempo – resistencia,https://dspace.espol.edu.ec/handle/123456789/53014,Ingeniería Civil,Facultad de Ingeniería en Ciencias de la Tierra
Obtención de concreto de alta resistencia mediante adición en el diseño de un superplastificante y ceniza de cascarilla de arroz,https://dspace.espol.edu.ec/handle/123456789/3325,Ingeniería Civil,Facultad de Ingeniería en Ciencias de la Tierra
Diseño Paramétrico de Naves Industriales de Acero y Caña Guadua (GaK) Mediante  los Softwares MATLAB y SAP2000 para Almacenamiento de Productos Agrícolas en  Cantón Yaguachi,https://dspace.espol.edu.ec/handle/123456789/60762,Ingeniería Civil,Facultad de Ingeniería en Ciencias de la Tierra
Base de agregados estabilizados con cemento,https://dspace.espol.edu.ec/handle/123456789/62051,Ingeniería Civil,Facultad de Ingeniería en Ciencias de la Tierra
Diseño Sismo Resistente De Centro De Salud Tipo B En El Barrio Urbirrios Manta-Ecuador,https://dspace.espol.edu.ec/handle/123456789/46705,Ingeniería Civil,Facultad de Ingeniería en Ciencias de la Tierra
Proceso de evaluación de volúmenes de agua no contabilizada en sistemas de distribución de agua potable. caso de estudio: cerro del carmen,https://dspace.espol.edu.ec/handle/123456789/6127,Ingeniería Civil,Facultad de Ingeniería en Ciencias de la Tierra
Estudios y diseños para la habilitación constructiva de los terrenos del proyecto Zede,https://dspace.espol.edu.ec/handle/123456789/54936,Ingeniería Civil,Facultad de Ingeniería en Ciencias de la Tierra
Proprietes Geotechniques Du Calcaire Criptocristallin,https://dspace.espol.edu.ec/handle/123456789/44487,Ingeniería Civil,Facultad de Ingeniería en Ciencias de la Tierra
Diseño estructural de la ampliación del puente prefabricado de 38.70m de longitud situado en la vía Babahoyo-ventanas sobre el estero la chorrera y el análisis de las conexiones de los elementos prefabricados,https://dspace.espol.edu.ec/handle/123456789/6123,Ingeniería Civil,Facultad de Ingeniería en Ciencias de la Tierra
Dimensionamiento del sistema de tratamiento de aguas residuales industriales en la industria de la pintura,https://dspace.espol.edu.ec/handle/123456789/62049,Ingeniería Civil,Facultad de Ingeniería en Ciencias de la Tierra
"Diseño De Un Edificio De 5 Pisos En Suelos Muy Blandos En La Parroquia Puerto Bolívar, Provincia De El Oro",https://dspace.espol.edu.ec/handle/123456789/48582,Ingeniería Civil,Facultad de Ingeniería en Ciencias de la Tierra
"Afectaciones por la explotación pétrea en cauce del río pita, sector playas de ojiva, cantón Babahoyo, provincia de los ríos. propuesta de soluciones",https://dspace.espol.edu.ec/handle/123456789/31805,Ingeniería Civil,Facultad de Ingeniería en Ciencias de la Tierra
Propuesta de soluciones técnicas para la estabilización de taludes de roca blanda en la vía Guayaquil - Progreso   (km. 24 - km. 64),https://dspace.espol.edu.ec/handle/123456789/10149,Ingeniería Civil,Facultad de Ingeniería en Ciencias de la Tierra
"Propuestas De Mejora Para Un Camino Terciario Con Mezcla Suelo-Cemento Para El Recinto ""La Frutilla"" y La Comuna ""Bellavista Del Cerro""",https://dspace.espol.edu.ec/handle/123456789/48571,Ingeniería Civil,Facultad de Ingeniería en Ciencias de la Tierra
"Diseño estructural y de las instalaciones hidrosanitarias de un condominio de 3 plantas en Lomas de Urdesa, aplicando LEAN",https://dspace.espol.edu.ec/handle/123456789/59567,Ingeniería Civil,Facultad de Ingeniería en Ciencias de la Tierra
Adición de ceniza de cascarilla de arroz en hormigon compactado con rodillo,https://dspace.espol.edu.ec/handle/123456789/3305,Ingeniería Civil,Facultad de Ingeniería en Ciencias de la Tierra
"Prediseño estructural de la superestructura para un shopping comercial de 3 plantas en la ciudad de Tabacundo, provincia de Pichincha",https://dspace.espol.edu.ec/handle/123456789/55498,Ingeniería Civil,Facultad de Ingeniería en Ciencias de la Tierra
Diseño y puesta en marcha de un Sistema de Información Geográfica de la Comunidad de Madrid para el estudio de la distribución de metales pesados,https://dspace.espol.edu.ec/handle/123456789/54807,Ingeniería Civil,Facultad de Ingeniería en Ciencias de la Tierra
Diseño de una propuesta pedagógica para la enseñanza de la derivada de una función en primero de bachillerato general unificado,https://dspace.espol.edu.ec/handle/123456789/57757,Ingeniería Civil,Facultad de Ingeniería en Ciencias de la Tierra
"Estudio y diseño de una planta de potabilización para la parroquia de Piedra Grande en el cantón Echeandía, Provincia de Bolívar",https://dspace.espol.edu.ec/handle/123456789/57820,Ingeniería Civil,Facultad de Ingeniería en Ciencias de la Tierra
Estudio de prefactibilidad de un edificio de cuatro plantas en la Cooperativa de vivienda Guayaquil,https://dspace.espol.edu.ec/handle/123456789/54935,Ingeniería Civil,Facultad de Ingeniería en Ciencias de la Tierra
Manual de diseño del sisteon-medios terama hidrosanitario para edificaciones aplicado al hospital docente universitario (hospitalizacipeuticos-medios de diagnostico),https://dspace.espol.edu.ec/handle/123456789/62060,Ingeniería Civil,Facultad de Ingeniería en Ciencias de la Tierra
Desarrollo del sistema hidrosanitario de una finca en la comunidad “San Joaquín” de El Triunfo,https://dspace.espol.edu.ec/handle/123456789/65902,Ingeniería Civil,Facultad de Ingeniería en Ciencias de la Tierra
Diseño integral de vivienda social de 2 Pisos Implementando parcialmente impresión de hormigón 3D,https://dspace.espol.edu.ec/handle/123456789/65910,Ingeniería Civil,Facultad de Ingeniería en Ciencias de la Tierra
"Metodología para la planificación de conjunto habitacional, caso de estudio: conjunto habitacional de 41 familias.",https://dspace.espol.edu.ec/handle/123456789/30594,Ingeniería Civil,Facultad de Ingeniería en Ciencias de la Tierra
Diseño del nuevo edificio para la municipalidad de Bucay,https://dspace.espol.edu.ec/handle/123456789/51476,Ingeniería Civil,Facultad de Ingeniería en Ciencias de la Tierra
"Modelaje de un sistema de alcantarillado pluvial en el área de drenaje de los esteros miraflores y represado, ciudad de Guayaquil",https://dspace.espol.edu.ec/handle/123456789/21260,Ingeniería Civil,Facultad de Ingeniería en Ciencias de la Tierra
Análisis de la utilización de materiales alternativos en la remoción de sólidos totales presentes en el agua cruda.,https://dspace.espol.edu.ec/handle/123456789/30619,Ingeniería Civil,Facultad de Ingeniería en Ciencias de la Tierra
Diseño de un sistema de conducción y zona de captación de agua para riego en la parroquia San Simón del cantón Guaranda,https://dspace.espol.edu.ec/handle/123456789/57825,Ingeniería Civil,Facultad de Ingeniería en Ciencias de la Tierra
Informe técnico de la construcción de los graderíos de la cancha de futbol ubicada en el complejo deportivo de tecnologías.,https://dspace.espol.edu.ec/handle/123456789/38348,Ingeniería Civil,Facultad de Ingeniería en Ciencias de la Tierra
Diseño de Red de Distribución de Agua Potable Para el Recinto Las Margaritas Del Cantón Samborondón en la Provincia Del Guayas.,https://dspace.espol.edu.ec/handle/123456789/38822,Ingeniería Civil,Facultad de Ingeniería en Ciencias de la Tierra
"Diseño paramétrico de viviendas de interés social de 2 plantas con sus instalaciones sanitarias, eléctricas y mecánicas para la ciudad de Guayaquil",https://dspace.espol.edu.ec/handle/123456789/57829,Ingeniería Civil,Facultad de Ingeniería en Ciencias de la Tierra
"Análisis, diseño de elementos estructurales utilizando hormigón de alto desempeño (had) y comparación con elementos estructurales diseñados con hormigones convencionales para soportar las mismas condiciones de carga",https://dspace.espol.edu.ec/handle/123456789/7266,Ingeniería Civil,Facultad de Ingeniería en Ciencias de la Tierra
Diseño de planta de puré de banano,https://dspace.espol.edu.ec/handle/123456789/54613,Ingeniería Civil,Facultad de Ingeniería en Ciencias de la Tierra
Manejo de Aguas Residuales y Planta de Tratamiento en la Comuna Sacachún-Cantón Santa Elena-Provincia de Santa Elena.,https://dspace.espol.edu.ec/handle/123456789/34378,Ingeniería Civil,Facultad de Ingeniería en Ciencias de la Tierra
Diseño de vivienda unifamiliar de dos niveles con sistema aporticado y de  confinamiento aplicando elementos finitos en Santa Elena,https://dspace.espol.edu.ec/handle/123456789/63158,Ingeniería Civil,Facultad de Ingeniería en Ciencias de la Tierra
Análisis sismorresistente de sistemas estructurales y diseños por capacidad,https://dspace.espol.edu.ec/handle/123456789/44963,Ingeniería Civil,Facultad de Ingeniería en Ciencias de la Tierra
Propuesta De Diseño De Pavimento Rígido De La Vía Virgen De Fátima – Naranjal (km 11) -Taura,https://dspace.espol.edu.ec/handle/123456789/46908,Ingeniería Civil,Facultad de Ingeniería en Ciencias de la Tierra
Comparación entre la capacidad portante para zapatas corridas obtenidas con los modelos Cam-Clay modificado y Mohr-Coulomb. Mediante un análisis determinístico de elementos finitos,https://dspace.espol.edu.ec/handle/123456789/30966,Ingeniería Civil,Facultad de Ingeniería en Ciencias de la Tierra
Evaluación técnica para el diseño de los laboratorios de mecánica de suelos y hormigones en la Espol y diseño de un software para el cálculo y generación de reportes de ensayos de laboratorio,https://dspace.espol.edu.ec/handle/123456789/45040,Ingeniería Civil,Facultad de Ingeniería en Ciencias de la Tierra
Diseño De Un Edificio De Dos Plantas Para La Dirección De Distribución De La Empresa Eléctrica Pública Estratégica Corporación Nacional De Electricidad – Unidad De Negocios El Oro,https://dspace.espol.edu.ec/handle/123456789/46911,Ingeniería Civil,Facultad de Ingeniería en Ciencias de la Tierra
"Diseño de las readecuaciones de las redes hidrosanitarias de las instalaciones del antiguo edificio del Telégrafo, para los ocupantes de la Zona 8 de la Policía Nacional del Ecuador",https://dspace.espol.edu.ec/handle/123456789/65906,Ingeniería Civil,Facultad de Ingeniería en Ciencias de la Tierra
"Diseño de la estructura de pavimento flexible de la vía: playas de Vinces - Bagatela, de longitud=5km. En la provincia de los Ríos",https://dspace.espol.edu.ec/handle/123456789/24950,Ingeniería Civil,Facultad de Ingeniería en Ciencias de la Tierra
Manejo De Los Desechos Sólidos Que Se Producen En La Ciudad De Pasaje – Provincia De El Oro,https://dspace.espol.edu.ec/handle/123456789/43446,Ingeniería Civil,Facultad de Ingeniería en Ciencias de la Tierra
"Diseño sismo-resistente de edificio metálico de 4 pisos, para uso oficinas - residencial en la ciudad de Manta.",https://dspace.espol.edu.ec/handle/123456789/65920,Ingeniería Civil,Facultad de Ingeniería en Ciencias de la Tierra
Análisis del Comportamiento de Columnas de Puentes de Concreto Reforzado a través de Diagramas de Interacción y Relaciones Momento-Curvatura,https://dspace.espol.edu.ec/handle/123456789/54798,Ingeniería Civil,Facultad de Ingeniería en Ciencias de la Tierra
Aplicación del criterio del sistema de control de costos mediante el análisis de rendimiento y productividad como una herramienta para toma de decisiones en proyectos de infraestructura comercial. caso: Rio centro el Dorado.,https://dspace.espol.edu.ec/handle/123456789/30498,Ingeniería Civil,Facultad de Ingeniería en Ciencias de la Tierra
"Diseño en hormigón armado para una vivienda unifamiliar de dos pisos ubicada en Machala,  empleando diferentes materiales y cimentaciones, aplicando metodología BIM",https://dspace.espol.edu.ec/handle/123456789/60749,Ingeniería Civil,Facultad de Ingeniería en Ciencias de la Tierra
Pérdidas Operacionales Generadas en la Construcción de una Urbanización: Análisis de sus Causas y Soluciones Mediante la Filosofía de Lean Construction,https://dspace.espol.edu.ec/handle/123456789/37192,Ingeniería Civil,Facultad de Ingeniería en Ciencias de la Tierra
Avalúo de los predios del campus Ing. Gustavo Galindo Velasco - edificios de gobierno FICT y Arqueología,https://dspace.espol.edu.ec/handle/123456789/3353,Ingeniería Civil,Facultad de Ingeniería en Ciencias de la Tierra
"Análisis de operaciones y procesos alternos para el tratamiento de agua dura que abastece a la parroquia San Cristóbal, cantón Paute, Provincia del Azuay",https://dspace.espol.edu.ec/handle/123456789/52227,Ingeniería Civil,Facultad de Ingeniería en Ciencias de la Tierra
"Estudio y diseño del nuevo museo arqueológico en valdivia, provincia de Santa Elena",https://dspace.espol.edu.ec/handle/123456789/55489,Ingeniería Civil,Facultad de Ingeniería en Ciencias de la Tierra
"Diseño Del Nuevo Relleno Sanitario, En Zona Inundable; Del Cantón San Jacinto De Yaguachi",https://dspace.espol.edu.ec/handle/123456789/46453,Ingeniería Civil,Facultad de Ingeniería en Ciencias de la Tierra
Optimización del diseño estructural sismorresistente de una edificación de 5  pisos ubicada en Vía a la Costa,https://dspace.espol.edu.ec/handle/123456789/63123,Ingeniería Civil,Facultad de Ingeniería en Ciencias de la Tierra
Diseño De Los Sistemas De Alcantarillado Sanitario y Pluvial Para La Urbanización Privada Balcones Del Norte Ubicada En El Cantón El Empalme En La Provincia Del Guayas,https://dspace.espol.edu.ec/handle/123456789/48551,Ingeniería Civil,Facultad de Ingeniería en Ciencias de la Tierra
"Diseño de un dique en el río Valdivia-California para el aprovechamiento  hídrico de la comuna en el sector Loma Alta, Santa Elena",https://dspace.espol.edu.ec/handle/123456789/63159,Ingeniería Civil,Facultad de Ingeniería en Ciencias de la Tierra
Análisis y Diseño En Acero Estructural De Una Planta De Preproceso De Pescado En El Cantón  Jaramijó,https://dspace.espol.edu.ec/handle/123456789/46741,Ingeniería Civil,Facultad de Ingeniería en Ciencias de la Tierra
Mantenimiento de una losa de concreto hidraulico en un pavimento rigido. caso practico calle Teodoro Maldonado c (desde calle 12ava este hasta juan m Carbo noboa) en la ciudadela kennedy en la ciudad de Guayaquil (l=571m),https://dspace.espol.edu.ec/handle/123456789/24947,Ingeniería Civil,Facultad de Ingeniería en Ciencias de la Tierra
"Rediseño y construcción de un pavimento existente, empleando fibras  metálicas para la mejora de su durabilidad en Guayas - Ecuador",https://dspace.espol.edu.ec/handle/123456789/60729,Ingeniería Civil,Facultad de Ingeniería en Ciencias de la Tierra
Diseño Estructural de un edificio residencial para los estudiantes de la Espol.,https://dspace.espol.edu.ec/handle/123456789/32314,Ingeniería Civil,Facultad de Ingeniería en Ciencias de la Tierra
"Prediseño De Una Presa Multipropósito En La Comuna Febres Cordero, Parroquia Colonche, Cantón Santa Elena, Provincia De Santa Elena",https://dspace.espol.edu.ec/handle/123456789/46687,Ingeniería Civil,Facultad de Ingeniería en Ciencias de la Tierra
Diseño de un Paradero con Fines Turísticos Basado en un Diseño Sustentable en Puerto Engabao,https://dspace.espol.edu.ec/handle/123456789/37191,Ingeniería Civil,Facultad de Ingeniería en Ciencias de la Tierra
"Diseño estructural de un complejo industrial multifuncional: taller, almacenamiento y oficinas en la parroquia El Salto, Babahoyo",https://dspace.espol.edu.ec/handle/123456789/65908,Ingeniería Civil,Facultad de Ingeniería en Ciencias de la Tierra
Lodo de perforación para pozos horizontales,https://dspace.espol.edu.ec/handle/123456789/6241,Ingeniería Civil,Facultad de Ingeniería en Ciencias de la Tierra
Diseño de un tanque de almacenamiento de agua potable para el abastecimiento de la demanda futura proyectada en la comunidad de Manglaralto,https://dspace.espol.edu.ec/handle/123456789/59578,Ingeniería Civil,Facultad de Ingeniería en Ciencias de la Tierra
"Estudio técnico de prefactibilidad para la segunda etapa del malecón de palestina, cantón Palestina",https://dspace.espol.edu.ec/handle/123456789/52198,Ingeniería Civil,Facultad de Ingeniería en Ciencias de la Tierra
Diseño de pavimentos articulados para el proyecto sector 3 en la ciudad de Guayaquil con la aplicación del programa pavementsoft,https://dspace.espol.edu.ec/handle/123456789/62046,Ingeniería Civil,Facultad de Ingeniería en Ciencias de la Tierra
"Estudios y recomendaciones geotécnicas para la construcción y movimiento de tierra de los estribos del puente Chantaco en la vía Cuenca-Girón-Pasaje, tramo Lentag-San Francisco",https://dspace.espol.edu.ec/handle/123456789/24863,Ingeniería Civil,Facultad de Ingeniería en Ciencias de la Tierra
Utilización del Epanet  T a un sistema de agua potable,https://dspace.espol.edu.ec/handle/123456789/3350,Ingeniería Civil,Facultad de Ingeniería en Ciencias de la Tierra
"Estudio y diseño de factibilidad para estabilizar y construir los estribos del nuevo puente de la calle ""Héroes del Cenepa"", en la ciudad de Caluma, provincia de Bolívar",https://dspace.espol.edu.ec/handle/123456789/51444,Ingeniería Civil,Facultad de Ingeniería en Ciencias de la Tierra
Diseño De Bypass En El Límite Urbano Del Cantón Naranjito,https://dspace.espol.edu.ec/handle/123456789/48721,Ingeniería Civil,Facultad de Ingeniería en Ciencias de la Tierra
Sistema constructivo de una estructura mixta metálicas y hormigón armado de un centro de distribución de alimentos ¨Sweet and Coffee,https://dspace.espol.edu.ec/handle/123456789/59575,Ingeniería Civil,Facultad de Ingeniería en Ciencias de la Tierra
Estudio de Prefactibilidad Tecnica Para el Trazado de la Carretera Sacachún la Ciénega al Sur de la Provincia de Santa Elena.,https://dspace.espol.edu.ec/handle/123456789/36521,Ingeniería Civil,Facultad de Ingeniería en Ciencias de la Tierra
Materiales utilizados en la construcción del túnel san Eduardo de la ciudad de Guayaquil: características e importancia de su uso,https://dspace.espol.edu.ec/handle/123456789/13340,Ingeniería Civil,Facultad de Ingeniería en Ciencias de la Tierra
Diseño de tratamiento terciario como alternativa para el reúso de  los efluentes de la PTAR del GAD Ibarra,https://dspace.espol.edu.ec/handle/123456789/65536,Ingeniería Civil,Facultad de Ingeniería en Ciencias de la Tierra
Hormigón De Alta Resistencia Con Nanosílice,https://dspace.espol.edu.ec/handle/123456789/46906,Ingeniería Civil,Facultad de Ingeniería en Ciencias de la Tierra
Susceptibilidad al deslizamiento de los suelos y rocas de la provincia de Manabí,https://dspace.espol.edu.ec/handle/123456789/3348,Ingeniería Civil,Facultad de Ingeniería en Ciencias de la Tierra
Diseño estructural sismo-resistente e instalaciones de un Edificio de Música y  Salón de Eventos para la Unidad Educativa San José La Salle Campus Norte en  Guayaquil,https://dspace.espol.edu.ec/handle/123456789/60753,Ingeniería Civil,Facultad de Ingeniería en Ciencias de la Tierra
Análisis del comportamiento del diagrama momento curvatura para vigas,https://dspace.espol.edu.ec/handle/123456789/44422,Ingeniería Civil,Facultad de Ingeniería en Ciencias de la Tierra
