NOMBREPROYEC,URL,CARRERA,FACULTAD
"Optimización del diseño de explotación de la cantera cerro grande, ubicada en el cantón Durán, provincia del Guayas - Ecuador.",https://dspace.espol.edu.ec/handle/123456789/48807,Minas,Facultad de Ingeniería en Ciencias de la Tierra
Producción de pigmentos a partir de minerales de óxidos de hierro para su aplicación en hormigones integralmente coloreados.,https://dspace.espol.edu.ec/handle/123456789/32489,Minas,Facultad de Ingeniería en Ciencias de la Tierra
Estimación de Reservas Minerales y Propuesta de Diseño Preliminar de Explotación del Bloque 2 del Sector “x7” Mina las Paralelas Utilizando Herramientas Informáticas,https://dspace.espol.edu.ec/handle/123456789/37193,Minas,Facultad de Ingeniería en Ciencias de la Tierra
Diseño de Planificación Minera a Cielo Abierto de un Yacimiento Aurífero Considerando la Incertidumbre Geológica.,https://dspace.espol.edu.ec/handle/123456789/38942,Minas,Facultad de Ingeniería en Ciencias de la Tierra
Gestión del movimiento de tierras y aprovechamiento de las zeolitas naturales existentes en el parque tecnologico del campus-ESPOL,https://dspace.espol.edu.ec/handle/123456789/3309,Minas,Facultad de Ingeniería en Ciencias de la Tierra
"Diseño De Un Modelo De Gestión Para La Explotación Sostenible De Materiales Áridos y Pétreos En El Cantón Coronel Marcelino Maridueña, Provincia Del Guayas",https://dspace.espol.edu.ec/handle/123456789/47381,Minas,Facultad de Ingeniería en Ciencias de la Tierra
"Plan de explotación de material pétreo en el sector urbano de la Isla  Santa Cruz (Galápagos), Ecuador",https://dspace.espol.edu.ec/handle/123456789/60774,Minas,Facultad de Ingeniería en Ciencias de la Tierra
Optimización de la operación de explotación de caliza. Referencia: Concesiones mineras Preconsa y ampliación Precón.,https://dspace.espol.edu.ec/handle/123456789/3326,Minas,Facultad de Ingeniería en Ciencias de la Tierra
"Evaluación del potencial de generación de drenaje ácido en depósitos de  relaves del Campo Minero Ponce Enríquez, Ecuador",https://dspace.espol.edu.ec/handle/123456789/63178,Minas,Facultad de Ingeniería en Ciencias de la Tierra
"Optimización del proceso de perforación y voladura en una mina dedicada a la extracción metálica a pequeña escala en la comunidad la Fortuna, Ponce Enríquez",https://dspace.espol.edu.ec/handle/123456789/52305,Minas,Facultad de Ingeniería en Ciencias de la Tierra
Propuesta de Optimización del Sistema de Carga y Transporte en una Cantera de Calizas Ubicada en el Km 12 ½ Vía a la Costa,https://dspace.espol.edu.ec/handle/123456789/37194,Minas,Facultad de Ingeniería en Ciencias de la Tierra
Diseño de un sistema descentralizado de ósmosis inversa aplicado a la remoción de metales pesados en efluentes mineros,https://dspace.espol.edu.ec/handle/123456789/57855,Minas,Facultad de Ingeniería en Ciencias de la Tierra
Optimización en la etapa de concentración del topacio imperial en la mina de Capao - Brasil,https://dspace.espol.edu.ec/handle/123456789/3331,Minas,Facultad de Ingeniería en Ciencias de la Tierra
Caracterización tecnológica y mineralógica de la mena de hierro del yacimiento capao Xavier,https://dspace.espol.edu.ec/handle/123456789/3364,Minas,Facultad de Ingeniería en Ciencias de la Tierra
"Diseño de Explotación Minera de Materiales de Construcción de la Comuna Prosperidad, en el Cantón Santa Elena, Ecuador",https://dspace.espol.edu.ec/handle/123456789/48808,Minas,Facultad de Ingeniería en Ciencias de la Tierra
"Elaboración de un plan de explotación de aguas subterráneas en una zona de la península de Santa Elena, mediante la interpretación de métodos resistivos",https://dspace.espol.edu.ec/handle/123456789/6093,Minas,Facultad de Ingeniería en Ciencias de la Tierra
Estudio para la optimización de un circuito flotación-cianuración de concentrados sulfurosos en la planta de beneficio la López para el procesamiento del mineral de la mina Jerusalén en el cantón Camilo Ponce Enríquez.,https://dspace.espol.edu.ec/handle/123456789/32270,Minas,Facultad de Ingeniería en Ciencias de la Tierra
Diseño de Pre-tratamiento Alcalino Para Proceso de Cianuración de Oro Desde Concentrados de Flotación de Menas Refractarias.,https://dspace.espol.edu.ec/handle/123456789/38943,Minas,Facultad de Ingeniería en Ciencias de la Tierra
Modelización geoestadística de un yacimiento de oro-plata del distrito minero La Joya (Oruro - Bolivia) y análisis de una aplicación en el Ecuador,https://dspace.espol.edu.ec/handle/123456789/45997,Minas,Facultad de Ingeniería en Ciencias de la Tierra
Procedimientos de acidificación matricial en pozos de petróleo,https://dspace.espol.edu.ec/handle/123456789/61137,Petróleos,Facultad de Ingeniería en Ciencias de la Tierra
Predicción de la Producción de Pozos de Petróleo del Campo Sacha utilizando Analítica de Datos,https://dspace.espol.edu.ec/handle/123456789/63171,Petróleos,Facultad de Ingeniería en Ciencias de la Tierra
Optimización del uso de polímeros en la perforación de pozos en campos marginales en el oriente ecuatoriano (caso Bermejo),https://dspace.espol.edu.ec/handle/123456789/3330,Petróleos,Facultad de Ingeniería en Ciencias de la Tierra
Diseño del programa de brocas y optimización del rendimiento para los pozos direccionales del campo Sacha de Petro producción.,https://dspace.espol.edu.ec/handle/123456789/44401,Petróleos,Facultad de Ingeniería en Ciencias de la Tierra
Determinación y análisis de la porosidad y permeabilidad de areniscas consolidadas de un pozo del oriente ecuatoriano.,https://dspace.espol.edu.ec/handle/123456789/44608,Petróleos,Facultad de Ingeniería en Ciencias de la Tierra
Interpretación de una prueba de pozo DST mediante el uso del software saphir luego de un trabajo de acidificación.,https://dspace.espol.edu.ec/handle/123456789/32259,Petróleos,Facultad de Ingeniería en Ciencias de la Tierra
Análisis del sector petrolero ecuatoriano durante la pandemia COVID-19 y su incidencia en la balanza comercial petrolera,https://dspace.espol.edu.ec/handle/123456789/50497,Petróleos,Facultad de Ingeniería en Ciencias de la Tierra
Optimización de producción por medio de tubos Venturi en líneas de superficie con presiones altas.,https://dspace.espol.edu.ec/handle/123456789/57868,Petróleos,Facultad de Ingeniería en Ciencias de la Tierra
"Cálculos de los parámetros T, RMF, RMC, Rw y porosidad usando la computadora digital 1130 y en base a los registros eléctricos",https://dspace.espol.edu.ec/handle/123456789/43810,Petróleos,Facultad de Ingeniería en Ciencias de la Tierra
Método combinado computarizado para predecir el comportamiento de un yacimiento sometido a inyección de agua,https://dspace.espol.edu.ec/handle/123456789/3322,Petróleos,Facultad de Ingeniería en Ciencias de la Tierra
Optimización de revestimiento de pozos,https://dspace.espol.edu.ec/handle/123456789/6242,Petróleos,Facultad de Ingeniería en Ciencias de la Tierra
Optimización del bombeo mecánico del campo tigre,https://dspace.espol.edu.ec/handle/123456789/3327,Petróleos,Facultad de Ingeniería en Ciencias de la Tierra
Interpretación de una prueba de disipación de presión (falloff) con fractura hidraulica mediante el uso de un software,https://dspace.espol.edu.ec/handle/123456789/24948,Petróleos,Facultad de Ingeniería en Ciencias de la Tierra
Análisis comparativo de las pruebas de presión entre pozos de petróleo del oriente ecuatoriano y pozos de gas del campo amistad,https://dspace.espol.edu.ec/handle/123456789/54996,Petróleos,Facultad de Ingeniería en Ciencias de la Tierra
Análisis De Factibilidad Tecnico-Economica Para La Aplicación De Completación Inteligente En Un Pozo Del Campo VHR Del Oriente Ecuatoriano,https://dspace.espol.edu.ec/handle/123456789/47064,Petróleos,Facultad de Ingeniería en Ciencias de la Tierra
Análisis de las técnicas y de los procesos aplicables en reacondicionamiento de pozos,https://dspace.espol.edu.ec/handle/123456789/16224,Petróleos,Facultad de Ingeniería en Ciencias de la Tierra
Diseño de tubería de revestimiento y cementación de un pozo en el Oriente Ecuatoriano,https://dspace.espol.edu.ec/handle/123456789/61191,Petróleos,Facultad de Ingeniería en Ciencias de la Tierra
Análisis objetivo de la producción para probar los beneficios de sobrepasar la zona de daño al punzar un pozo de petroleo. aplicación al campo Cononaco de Petro producción,https://dspace.espol.edu.ec/handle/123456789/3318,Petróleos,Facultad de Ingeniería en Ciencias de la Tierra
"Estudio para la optimización del fluido ""drill-in"" para las zonas productoras del campo Auca - EP Petroecuador.",https://dspace.espol.edu.ec/handle/123456789/21132,Petróleos,Facultad de Ingeniería en Ciencias de la Tierra
Diseño Conceptual de un Tratamiento Para Separación de Sólidos en Suspensión en un Sistema de Hidrocarburos Liquidos.,https://dspace.espol.edu.ec/handle/123456789/36570,Petróleos,Facultad de Ingeniería en Ciencias de la Tierra
Estudio y revaluación de las formaciones del campo santa paula en base a información de perfiles de pozos,https://dspace.espol.edu.ec/handle/123456789/61196,Petróleos,Facultad de Ingeniería en Ciencias de la Tierra
Diseño y calibración de un equipo para medición de presión capilar,https://dspace.espol.edu.ec/handle/123456789/6142,Petróleos,Facultad de Ingeniería en Ciencias de la Tierra
Programa computacional para predecir el comportamiento de un yacimiento sometido A inyección de agua por el método decraig geffen and morse,https://dspace.espol.edu.ec/handle/123456789/21256,Petróleos,Facultad de Ingeniería en Ciencias de la Tierra
Estudio sobre los Impactos de la Explotación Petrolera en el campo Lago Agrio Bloque 56 y el uso de los skimmers como una solución en los derrames petroleros,https://dspace.espol.edu.ec/handle/123456789/59699,Petróleos,Facultad de Ingeniería en Ciencias de la Tierra
Lodos de perforación características y aditivos,https://dspace.espol.edu.ec/handle/123456789/44382,Petróleos,Facultad de Ingeniería en Ciencias de la Tierra
Análisis y aplicación de modelos de flujo y límites del reservorio mediante la utilización de pruebas de presión realizadas en los yacimientos de hidrocarburos del país.,https://dspace.espol.edu.ec/handle/123456789/32291,Petróleos,Facultad de Ingeniería en Ciencias de la Tierra
Análisis de los problemas operacionales durante la corrida de un equipo electrosumergible.,https://dspace.espol.edu.ec/handle/123456789/44590,Petróleos,Facultad de Ingeniería en Ciencias de la Tierra
Análisis de las permeabilidades relativas y su obtención en el laboratorio,https://dspace.espol.edu.ec/handle/123456789/38350,Petróleos,Facultad de Ingeniería en Ciencias de la Tierra
Análisis técnico económico para la optimización de la producción del campo ESPOL-FICT,https://dspace.espol.edu.ec/handle/123456789/52274,Petróleos,Facultad de Ingeniería en Ciencias de la Tierra
Análisis Técnico Para La Optimización De La Producción De Petróleo En El Campo Pata,https://dspace.espol.edu.ec/handle/123456789/46884,Petróleos,Facultad de Ingeniería en Ciencias de la Tierra
Optimización De La Inyectividad De Los Pozos Reinyectores Del Activo Shushufindi,https://dspace.espol.edu.ec/handle/123456789/46099,Petróleos,Facultad de Ingeniería en Ciencias de la Tierra
Diseño De Una Estación de Flujo,https://dspace.espol.edu.ec/handle/123456789/44320,Petróleos,Facultad de Ingeniería en Ciencias de la Tierra
Diagnóstico y rediseño de las facilidades de separación en el área auca,https://dspace.espol.edu.ec/handle/123456789/3378,Petróleos,Facultad de Ingeniería en Ciencias de la Tierra
Determinación de los constantes de archi para la formación Napo,https://dspace.espol.edu.ec/handle/123456789/3376,Petróleos,Facultad de Ingeniería en Ciencias de la Tierra
"Evaluación de los parámetros principales de diseño, rediseño y operación de las plantas deshidratadoras de gas natural del campo Shushufindi",https://dspace.espol.edu.ec/handle/123456789/3432,Petróleos,Facultad de Ingeniería en Ciencias de la Tierra
"Análisis de la contaminación térmica, del suelo y visual producidas por actividades petroleras en la región Americana",https://dspace.espol.edu.ec/handle/123456789/52286,Petróleos,Facultad de Ingeniería en Ciencias de la Tierra
Análisis comparativo técnico-económico entre pozos direccionales tipo S versus pozos direccionales tipo J en campo ESPOL,https://dspace.espol.edu.ec/handle/123456789/57893,Petróleos,Facultad de Ingeniería en Ciencias de la Tierra
Análisis técnico y económico para la implementación del tratamiento de pozo con modificador de permeabilidad relativa para el retardo de la intrusión de agua y aumentar la producción de petróleo en el campo ESPOL,https://dspace.espol.edu.ec/handle/123456789/54822,Petróleos,Facultad de Ingeniería en Ciencias de la Tierra
"Técnicas para estimular la matriz de un yacimiento: objetivos, problemas, soluciones y proceso operacional.",https://dspace.espol.edu.ec/handle/123456789/32254,Petróleos,Facultad de Ingeniería en Ciencias de la Tierra
Elaboración de Mapa de Riesgo de los Pozos Horizontales Perforados desde el Año 2006 al 2007 en el Campo Fanny del Bloque Tarapoa para el Mejoramiento de los Ensamblajes de Fondo de la Sección Intermedia de 12 1/4,https://dspace.espol.edu.ec/handle/123456789/13465,Petróleos,Facultad de Ingeniería en Ciencias de la Tierra
Estudio del rendimiento de la broca hcm605z para la sección de 12 ¼ diseñada para la perforación de pozos horizontales en el campo tarapoa,https://dspace.espol.edu.ec/handle/123456789/6238,Petróleos,Facultad de Ingeniería en Ciencias de la Tierra
"Methods for restoring productivity to gas wells in the clinton sand of ohio, a laboratory and field experiment",https://dspace.espol.edu.ec/handle/123456789/60029,Petróleos,Facultad de Ingeniería en Ciencias de la Tierra
Cementación primaria de tuberías de revestimiento,https://dspace.espol.edu.ec/handle/123456789/32494,Petróleos,Facultad de Ingeniería en Ciencias de la Tierra
Cálculo del petróleo original in situ de una estructura real por diferentes métodos y análisis comparativos de los mismos.,https://dspace.espol.edu.ec/handle/123456789/32512,Petróleos,Facultad de Ingeniería en Ciencias de la Tierra
Estudio de riesgo sísmico para las zonas sensibles de la infraestructura de la refinería la Libertad.,https://dspace.espol.edu.ec/handle/123456789/30877,Petróleos,Facultad de Ingeniería en Ciencias de la Tierra
Interpretación de la prueba de buildup en un pozo de petróleo en yacimientos naturalmente fracturados mediante uso del Software Saphir.,https://dspace.espol.edu.ec/handle/123456789/32292,Petróleos,Facultad de Ingeniería en Ciencias de la Tierra
Uso de herramientas de pesca en operaciones de reacondicionamiento de pozos petrolíferos en el oriente ecuatoriano,https://dspace.espol.edu.ec/handle/123456789/3349,Petróleos,Facultad de Ingeniería en Ciencias de la Tierra
Dimensionamiento de separadores de producción y prueba para el campo MARK 2 mediante el uso del método Half Full,https://dspace.espol.edu.ec/handle/123456789/54456,Petróleos,Facultad de Ingeniería en Ciencias de la Tierra
Estudio de sensibilidad sobre permeabilidades relativas en sistemas de drenaje,https://dspace.espol.edu.ec/handle/123456789/3404,Petróleos,Facultad de Ingeniería en Ciencias de la Tierra
"Revisión y análisis de la cementación primaria de los pozos b2-ip1x1, b2i-p2xi y b1p3x1 de belco petroleum del ecuador inc. ubicados en el golfo de Guayaquil",https://dspace.espol.edu.ec/handle/123456789/61202,Petróleos,Facultad de Ingeniería en Ciencias de la Tierra
Evaluación De Pozos Potenciales Para El Fracturamiento Hidráulico En El Campo Tapi – Bloque 57,https://dspace.espol.edu.ec/handle/123456789/43628,Petróleos,Facultad de Ingeniería en Ciencias de la Tierra
Estimación de tiempos no productivos en la perforación de  pozos direccionales. Caso de estudio Campo Tiputini,https://dspace.espol.edu.ec/handle/123456789/63181,Petróleos,Facultad de Ingeniería en Ciencias de la Tierra
Estudio experimental de las propiedades y determinación de la utilidad de diferentes arcillas del ecuador para emplearlas en la preparación de fluidos de perforación.,https://dspace.espol.edu.ec/handle/123456789/61086,Petróleos,Facultad de Ingeniería en Ciencias de la Tierra
"Análisis de pruebas de disipación de presión fall-off test en yacimientos compuestos, utilizando el software Saphir.",https://dspace.espol.edu.ec/handle/123456789/24864,Petróleos,Facultad de Ingeniería en Ciencias de la Tierra
"Estudio de factibilidad para la implementación de procesos IOR/EOR en el campo oso, reservorio napo u en base a modelos predictivos de balance de materia y simulación numérica, bloque 7, Cuenca Oriente - Ecuador",https://dspace.espol.edu.ec/handle/123456789/61012,Petróleos,Facultad de Ingeniería en Ciencias de la Tierra
"Modelos de permeabilidad y correlaciones con perfiles de pozos para el establecimiento de las unidades de flujo en los campos tetete-tapi, bloque 57",https://dspace.espol.edu.ec/handle/123456789/52266,Petróleos,Facultad de Ingeniería en Ciencias de la Tierra
Análisis Técnico Para El Desarrollo Del Campo Wati En La Arenisca M1A Empleando Sistemas De Control De Arena,https://dspace.espol.edu.ec/handle/123456789/43673,Petróleos,Facultad de Ingeniería en Ciencias de la Tierra
Evaluación de un fluido base amina-glicol para perforar pozos de petróleo en el oriente ecuatoriano.,https://dspace.espol.edu.ec/handle/123456789/32234,Petróleos,Facultad de Ingeniería en Ciencias de la Tierra
Aprovechamiento del gas de la zona sur del campo Pacoa como combustible de un grupo electrógeno generador,https://dspace.espol.edu.ec/handle/123456789/21541,Petróleos,Facultad de Ingeniería en Ciencias de la Tierra
Desarrollo De La Arena Basal Tena En El Well Pad Norte Del Campo Palo Azul,https://dspace.espol.edu.ec/handle/123456789/46878,Petróleos,Facultad de Ingeniería en Ciencias de la Tierra
Perforación de pozos profundos,https://dspace.espol.edu.ec/handle/123456789/38344,Petróleos,Facultad de Ingeniería en Ciencias de la Tierra
Evaluación de un modelo conceptual de simulación aplicando diferentes tipos de completaciones en el campo ESPOL,https://dspace.espol.edu.ec/handle/123456789/54823,Petróleos,Facultad de Ingeniería en Ciencias de la Tierra
Recuperación de producción en pozos con pescado en el campo sacha,https://dspace.espol.edu.ec/handle/123456789/6236,Petróleos,Facultad de Ingeniería en Ciencias de la Tierra
Evaluación de la tecnología aplicada al corte de ventanas en tuberías de revestimiento y sus resultados en la optimización de la producción de petróleo,https://dspace.espol.edu.ec/handle/123456789/61976,Petróleos,Facultad de Ingeniería en Ciencias de la Tierra
Predicción del comportamiento de un yacimiento del oriente ecuatoriano durante la etapa de bajo saturación sin entrada de agua.,https://dspace.espol.edu.ec/handle/123456789/32473,Petróleos,Facultad de Ingeniería en Ciencias de la Tierra
Estudio experimental de la variación de la viscosidad y filtración en un fluido de perforación utilizando el mangle como aditivo.,https://dspace.espol.edu.ec/handle/123456789/3412,Petróleos,Facultad de Ingeniería en Ciencias de la Tierra
"Análisis y cálculos detallados del trabajo de inyección de agua en el campo little creek por c. cronquist e inyección periférica de agua en el campo safbeu por r. denham, para material didáctico en los cursos de recobro secundario de petróleo",https://dspace.espol.edu.ec/handle/123456789/61918,Petróleos,Facultad de Ingeniería en Ciencias de la Tierra
"Estudio de la perforación multilateral aplicado en el campo cononaco, operado por petroproduccion",https://dspace.espol.edu.ec/handle/123456789/60995,Petróleos,Facultad de Ingeniería en Ciencias de la Tierra
Desarrollo de Programas Computacionales para Analizar Sistemas Básicos de Producción en Pozos de Petróleo,https://dspace.espol.edu.ec/handle/123456789/7835,Petróleos,Facultad de Ingeniería en Ciencias de la Tierra
Análisis de un fluido de competición y reacondicionamiento de pozos para determinar si previene el daño de formación en los campos fanny y dorine,https://dspace.espol.edu.ec/handle/123456789/61960,Petróleos,Facultad de Ingeniería en Ciencias de la Tierra
Análisis comparativo de la porosidad y saturación de fluidos a partir de muestras de areniscas consolidadas y de registros eléctricos de un pozo del Oriente Ecuatoriano,https://dspace.espol.edu.ec/handle/123456789/61128,Petróleos,Facultad de Ingeniería en Ciencias de la Tierra
Obtención de parámetros físicos por medio de pruebas de formación aplicado a los diferentes mecanismos de producción existentes en yacimientos del oriente ecuatoriano.,https://dspace.espol.edu.ec/handle/123456789/44570,Petróleos,Facultad de Ingeniería en Ciencias de la Tierra
Cementación primaria en el pozo EDJO 15: ubicado en el campo Virginia del oriente ecuatoriano,https://dspace.espol.edu.ec/handle/123456789/32230,Petróleos,Facultad de Ingeniería en Ciencias de la Tierra
Análisis Comparativo de las Pruebas de Presión entre Pozos de Petróleo del Oriente Ecuatoriano y Pozos de Gas del Campo Amistad,https://dspace.espol.edu.ec/handle/123456789/16967,Petróleos,Facultad de Ingeniería en Ciencias de la Tierra
Análisis del comportamiento de la viscosidad de crudos a condiciones de yacimiento y superficie.,https://dspace.espol.edu.ec/handle/123456789/3402,Petróleos,Facultad de Ingeniería en Ciencias de la Tierra
SIMULATION OF UNDERGROUND LIQUEFACTION OF LIGNITE,https://dspace.espol.edu.ec/handle/123456789/61011,Petróleos,Facultad de Ingeniería en Ciencias de la Tierra
Volumen Original De Petróleo y Constante De Entrada de Agua De Yacimientos Bajosaturados.,https://dspace.espol.edu.ec/handle/123456789/44361,Petróleos,Facultad de Ingeniería en Ciencias de la Tierra
Análisis general para la aplicación  de la completación inteligente en un pozo del oriente Ecuatoriano,https://dspace.espol.edu.ec/handle/123456789/3434,Petróleos,Facultad de Ingeniería en Ciencias de la Tierra
Evaluación de los efectos de la inyección del CO en operaciones de recuperación mejorada de petróleo para proponer un diseño experimental de análisis de recobro,https://dspace.espol.edu.ec/handle/123456789/57860,Petróleos,Facultad de Ingeniería en Ciencias de la Tierra
Optimización del proyecto de inyección de agua del campo Shushufindi,https://dspace.espol.edu.ec/handle/123456789/7851,Petróleos,Facultad de Ingeniería en Ciencias de la Tierra
Rehabilitación del sistema de re-Inyección de agua del campo Pata,https://dspace.espol.edu.ec/handle/123456789/49474,Petróleos,Facultad de Ingeniería en Ciencias de la Tierra
Manejo y aplicación práctica del software oilfield manager en el área tigre del campo Gustavo Galindo Velasco,https://dspace.espol.edu.ec/handle/123456789/3320,Petróleos,Facultad de Ingeniería en Ciencias de la Tierra
Desarrollo de un algoritmo computacional para predecir el comportamiento de una mezcla binaria de crudo mediante el modelo matemático de Arrhenius,https://dspace.espol.edu.ec/handle/123456789/54461,Petróleos,Facultad de Ingeniería en Ciencias de la Tierra
Estimación de la huella de carbono en el campo ITT por la operación de los Bloques Ishpingo Tambococha y Tiputini,https://dspace.espol.edu.ec/handle/123456789/63182,Petróleos,Facultad de Ingeniería en Ciencias de la Tierra
Identificación de Fronteras en Sistemas Pozo-Yacimiento a Partir de la Interpretación de Pruebas de Presión Usando el Software Saphir,https://dspace.espol.edu.ec/handle/123456789/35161,Petróleos,Facultad de Ingeniería en Ciencias de la Tierra
Estudio de las operaciones en una plataforma marina tipo auto elevadiza en ambiente costa afuera,https://dspace.espol.edu.ec/handle/123456789/44585,Petróleos,Facultad de Ingeniería en Ciencias de la Tierra
Aplicabilidad de la nanotecnología enfocada ala estimulación de las arenas productoras del Oriente Ecuatoriano.,https://dspace.espol.edu.ec/handle/123456789/51035,Petróleos,Facultad de Ingeniería en Ciencias de la Tierra
Viabilidad para la exploración y explotación de arenas bituminosas en el litoral Ecuatoriano,https://dspace.espol.edu.ec/handle/123456789/52284,Petróleos,Facultad de Ingeniería en Ciencias de la Tierra
Optimización Del Sistema De Levantamiento Artificial A Lo Largo Del Tiempo De Vida Productiva De Un Pozo En El Oriente Ecuatoriano,https://dspace.espol.edu.ec/handle/123456789/47070,Petróleos,Facultad de Ingeniería en Ciencias de la Tierra
Evaluación computarizada de una formación del oriente ecuatoriano utilizando el método de las tres porosidades,https://dspace.espol.edu.ec/handle/123456789/32495,Petróleos,Facultad de Ingeniería en Ciencias de la Tierra
Comparación de los resultados de los volúmenes encontrados a partir de los métodos: calibración líquida API 2555 y calibración por medidas API 2552 para un tanque esferoidal de la Refinería la Libertad,https://dspace.espol.edu.ec/handle/123456789/7840,Petróleos,Facultad de Ingeniería en Ciencias de la Tierra
Evaluación de los diseños de BHAen perforaciones horizontales (aplicado en el pozo amo b-10 del bloque 16 del oriente ecuatoriano),https://dspace.espol.edu.ec/handle/123456789/3431,Petróleos,Facultad de Ingeniería en Ciencias de la Tierra
"Diseño, corrida y cementación de un liner de producción  para el pozo ESPOL-2D",https://dspace.espol.edu.ec/handle/123456789/54864,Petróleos,Facultad de Ingeniería en Ciencias de la Tierra
